PCA1,PCA2,label,sentence,PCA3
0.07893124,0.02580395,correct_chess,e4 e6 d4 b6 a3 Bb7 Nc3 Nh6 Bxh6 gxh6 Be2 Qg5 Bg4 h5 Nf3 Qg6 Nh4 Qg5 Bxh5 Qxh4 Qf3 Kd8 Qxf7 Nc6 Qe8#,0.0016124888
0.022997735,-0.0056668734,correct_chess,d4 d5 Nf3 Nf6 e3 Bf5 Nh4 Bg6 Nxg6 hxg6 Nd2 e6 Bd3 Bd6 e4 dxe4 Nxe4 Rxh2 Ke2 Rxh1 Qxh1 Nc6 Bg5 Ke7 Qh7 Nxd4+ Kd2 Qe8 Qxg7 Qh8 Bxf6+ Kd7 Qxh8 Rxh8 Bxh8,0.02726546
0.101659484,0.03302343,correct_chess,e4 e5 Nf3 Nc6 Bc4 Nf6 Nc3 Bc5 a3 Bxf2+ Kxf2 Nd4 d3 Ng4+ Kf1 Qf6 h3 d5 Nxd5 Qe6 Nxc7+,-0.00516583
-0.06472661,0.020549184,correct_chess,e4 c6 Nc3 d5 Qf3 dxe4 Nxe4 Nd7 Bc4 Ngf6 Nxf6+ Nxf6 Qg3 Bf5 d3 Bg6 Ne2 e6 Bf4 Nh5 Qf3 Nxf4 Nxf4 Be7 Bxe6 fxe6 Nxe6 Qa5+ c3 Qe5+ Qe3 Qxe3+ fxe3 Kd7 Nf4 Bd6 Nxg6 hxg6 h3 Bg3+ Kd2 Raf8 Rhf1 Ke7 d4 Rxf1 Rxf1 Rf8 Rxf8 Kxf8 e4 Ke7 Ke3 g5 Kf3 Be1 Kg4 Bd2 Kf5 Bc1 Kg6 Kf8 e5 Bxb2 Kxg5 Bxc3 h4 Bxd4 h5 Bxe5 g4 Bb2 Kf5 Kf7 g5 Bc1 g6+ Ke7 Ke5 b5 Kd4 Kd6 Kc3 c5 a3 Bg5 a4 bxa4 Kb2 Kd5 Ka3 Kd4 Kxa4 c4,0.00088804803
0.01739769,-0.023520064,correct_chess,e4 e6 f4 d5 e5 c5 Nf3 Qb6 c3 Nc6 d3 Bd7 Be2 Nh6 O-O Nf5 g4 Nh6 Kg2 Nxg4 h3 Nh6 Ng5 Nf5 Bg4 Nce7 Nd2 Ne3+ Kf3 Nxd1 Rxd1 h6 Nxf7 Kxf7 Rf1 h5 Bxe6+ Bxe6 Kg3 Nf5+ Kg2 Ne3+ Kf2 Nxf1 Kxf1 Bxh3+,0.020028407
-0.032510053,0.002759732,correct_chess,e4 b6 Bc4 Bb7 d3 Nh6 Bxh6 gxh6 Qf3 e6 Nh3 Bg7 c3 Nc6 Qg3 Rg8 Qf3 Ne5 Qe3 Nxc4 dxc4 Qe7 O-O Qc5 Qxc5 b5 Qxb5 Bxe4 Nd2 Bc6 Qb3 Bxc3 g3 Bxd2 Rad1 Bg5 Nxg5 hxg5 Qd3 h6 b4 Ba4 Rd2 Rb8 b5 d6 Qa3 Bxb5 cxb5 Rxb5 Qxa7 Rc5 Qa8+ Ke7 Qxg8 e5 Qh8 d5 Qxe5+ Kd7 Rxd5+ Rxd5 Qxd5+,-0.00030606118
0.050198376,0.008118566,correct_chess,e4 e5 Nf3 Nc6 Bc4 Nf6 d3 Bc5 c3 O-O O-O d6 Bg5 Na5 Bb3 Nxb3 Qxb3 Be6 Qxb7 Rb8 Qa6 Rxb2 Nbd2 Rxd2 Nxd2 h6 Bh4 g5 Bg3 h5 h3 h4 Bh2 Qd7 Nf3 Bxh3 Nxg5 Qg4,-0.017884247
-0.00058764534,-0.017363515,correct_chess,e4 e5 c4 Bc5 Nf3 d6 d3 a6 a3 Bg4 h3 Bxf3 Qxf3 Qf6 Be2 Nd7 Nc3 Ne7 O-O Bd4 Bd2 h6 Rab1 g5 Qg4 c6 Be3 Ba7 Bxa7 Rxa7 b4 Qg6 Na4 h5 Qg3 Nf6 Qe3 Ra8 Nb6 Rb8 c5 d5 exd5 Nfxd5 Qxe5 Rd8 Qxh8+ Ng8 Bxh5 Qh6 Rbe1+ Ne7 Rxe7+ Kxe7 Re1+,-0.009209487
-0.043706283,0.007409578,correct_chess,d4 c5 c4 d6 Bf4 g6 Nf3 Bh6 Bxh6 Nxh6 Nc3 Nf5 d5 O-O e4 Nd4 Bd3 Bd7 O-O a6 Ng5 h5 Re1 e6 dxe6 Nxe6 Nxe6 Bxe6 Nd5 h4 h3 Bxh3 gxh3 Qg5+ Kf1 Nd7 Qa4 Nf6 Ne7+ Kh8 f3 Qg3 Ke2 Qxh3 Rh1 Qg2+ Ke3 h3 Qd1 Rae8 Bf1 Ng4+ Kd3 Ne5+ Kc3 Qg3 Rxh3+ Qxh3 Bxh3 Rxe7 Qxd6 Nc6 Rh1 Rd8 Qxc5 a5 Bd7+ Kg7 Bxc6 Rc7 Qe5+ f6 Qxc7+,0.005897847
-0.05693942,0.01814051,correct_chess,d4 e5 dxe5 d6 exd6 Bxd6 Nf3 Nf6 Nc3 O-O a3 Nc6 e3 a6 Be2 h6 O-O Ne5 Bd2 Nxf3+ Bxf3 Be5 Rc1 c6 Qe2 Qd6 Rfd1 Bxh2+ Kh1 Be5 e4 Bxc3 Bxc3 Qe6 Rd3 Bd7 Rcd1 Rad8 Bxf6 gxf6 Rd6 Qe7 R1d2 Be6 Rxd8 Rxd8 Rxd8+ Qxd8 c4 Qd4 c5 Qxc5 Qd2 f5 exf5 Bxf5 Qxh6 Bg6 Be4 Bxe4 Qh4 Bg6 Qd8+ Kg7 Qc7 b5 b4 Qc1+ Kh2 Qxa3 Qe5+ Kg8 Qe8+ Kg7 Qxc6 Qxb4 Qxa6 Qh4+ Kg1 b4 Qa1+ Qf6 Qa4 Qc3 f3 b3 Qa3 Qc2 Kh2 b2,-0.00037845675
-0.031366773,-0.013168683,correct_chess,e4 g6 d4 d6 Nf3 c6 h3 Nf6 Bg5 Nxe4 Qe2 Bf5 Nbd2 Qa5 c3 Nxd2 Bxd2 Nd7 b4 Qa3 Ng5 h5 Qc4 d5 Qe2 Qb2 Qd1 Bc2 Qc1 Qxc1+ Rxc1 Ba4 Bd3 Nb6 O-O Nc4 Bxc4 dxc4 Bf4 Bh6 Rfe1 O-O Rxe7 Rae8 Rxb7 f6 Ne6 Rxe6 Bxh6 Rf7 Rb8+ Kh7 Bf4 g5 Bd2 Re2 Be1 Rfe7 Kf1 Bc2 Rc8 Bd3 Rxc6 Rc2+ Kg1 Rxc1 Rxf6 h4 g4 Rexe1+ Kg2 Be4+ f3 Rc2#,-0.027862841
-0.07251032,0.018395668,correct_chess,e4 e6 d4 d5 Nc3 Nf6 Bg5 Be7 Bxf6 Bxf6 e5 Be7 Qg4 O-O Bd3 f5 Qg3 c5 Nf3 Qb6 Na4 Qb4+ Nc3 Qxb2 Kd2 cxd4 Nxd4 Bb4 Bb5 a6 Rhb1 Qxc3+ Qxc3 Bxc3+ Kxc3 axb5 Rxb5 Nc6 Nxc6 bxc6 Rc5 Bd7 a4 Ra6 a5 Rfa8 Kd4 g5 Ra4 h5 h3 f4 f3 Kf7 Kd3 Ke7 Ke2 Be8 Kf2 Kd7 g3 fxg3+ Kxg3 Bg6 Ra2 Bf5 h4 g4 fxg4 Bxg4 Kf4 Rf8+ Kg5 Rf5+ Kh6 Rxe5 Ra4 Kd6 Rc3 c5 Rg3 c4 Kg7 Kc5 Kf6 Re2 Ke7 Rxc2 Rxg4 hxg4 h5 Rh2 Ra3,-0.02014327
0.025908418,-0.025862485,correct_chess,e4 e5 Nf3 Nc6 Bc4 Bc5 a3 Qf6 b4 Bb6 d3 h6 Nc3 Nge7 O-O O-O Re1 a6 Be3 Nd4 Bxd4 exd4 e5 Qg6 Ne4 d5 exd6 cxd6 Bb3 Be6 Bxe6 fxe6 Nxd6 Rab8 Nc4 Ba7 Nfe5 Qe8 Nd6 Qd8 Ndc4 Qd5 Qg4 Rf5 Ng6 Nxg6 Qxg6 Re8 Qxe8+,-0.00061414123
-0.02312069,-0.0050821556,correct_chess,e4 e5 Nf3 Nc6 Bb5 Nge7 Nc3 h6 Nd5 a6 Ba4 b5 Bb3 Ng6 c4 b4 Ba4 Nd4 O-O c6 Ne3 a5 Nxd4 exd4 Nf5 Ba6 Nxd4 Bxc4 Nxc6 Bxf1 Nxd8 Bxg2 Nxf7 Bxe4 Qe2 Kxf7 Qxe4 Kg8 Qxa8 Kh7 Qe4 d5 Qxd5 Be7 d3 Rf8 Bb3 Nf4 Qe4+ Ng6 Be3 Bh4 Rf1 Bf6 Bd4 Bh4 f4 Bd8 f5 Ne7 f6+ Ng6 fxg7 Rxf1+ Kxf1 h5 g8=Q+ Kh6 Qexg6#,-0.01438933
-0.089717284,0.027902296,correct_chess,e4 c5 f4 d5 exd5 Qxd5 Nc3 Qd8 Bc4 Bf5 d3 a6 g4 Bd7 a4 e6 Bd2 Bc6 Nf3 Bxf3 Qxf3 Qh4+ Qg3 Qxg3+ hxg3 Nc6 O-O-O O-O-O f5 Ne5 fxe6 Nxc4 dxc4 fxe6 Rde1 Bd6 Bf4 Bxf4+ gxf4 Nh6 g5 Nf5 Rxe6 Rd4 Rf1 Rxc4 Re5 g6 Kd2 Rd8+ Kc1 Rd7 Nd5 Rd6 Ne7+ Nxe7 Rxe7 Rd7 Rxd7 Kxd7 b3 Re4 Kb2 Ke6 Kc3 Kf5 Rh1 Re7 Rf1 Re4 Rh1 Rxf4 Rxh7 Kxg5 Rxb7 Rf6 Rc7 Kf4 Rxc5 g5 b4 g4 Rc4+ Kf3 Rc5 Rg6 Rf5+ Kg2 b5 axb5 axb5 g3 Kb4 Kh1 Rd5 g2 Rd1+ g1=Q Rxg1+ Kxg1 c4 Kf2 c5 Ke3 b6 Kd4 b7 Rg1 Kb5 Rb1+ Kc6 Rb4 Kc7 Kxc5 b8=Q Rxb8 Kxb8,-0.0011597314
0.11588083,0.038065244,correct_chess,b3 e5 Bb2 e4 d3 Nf6 Nh3 d5 dxe4 Nxe4 Nf4 Qh4 g3 Bc5 f3 Bf2#,-0.0056009097
-0.022975132,-0.009585789,correct_chess,e4 e6 d4 d5 e5 c5 c3 Ne7 f4 cxd4 cxd4 Nf5 Nf3 Nc6 Bb5 Bd7 O-O Qb6 Bxc6 Bxc6 Nc3 Be7 a3 O-O b4 Rac8 Bb2 Bb5 Rf2 Bc4 Na4 Qc6 Nc5 b6 Nd3 a5 Bc3 a4 g4 Bxd3 Qxd3 Qxc3 Qxc3 Rxc3 gxf5 exf5 Kg2 Rfc8 Raa2 h5 h4 R8c6 Ng5 f6 exf6 Bxf6 Nf3 g6 Ne5 Bxe5 fxe5 Kg7 Rfe2 Rd3 e6 Rxd4 e7 Rg4+ Kf2 Re4 Rxe4 dxe4 e8=Q Rc3,-0.037072517
-0.088501096,0.03356178,correct_chess,e4 e6 d4 b6 d5 Bb4+ c3 Bc5 b4 Bd6 Nf3 exd5 e5 Qe7 Qxd5 Bxe5 Nxe5 c6 Qxf7+ Qxf7 Nxf7 Kxf7 Bc4+ Ke8 O-O d5 Re1+ Kd8 Bg5+ Kc7 Bb3 Nd7 c4 Ngf6 Bf4+ Kb7 cxd5 Nxd5 Bxd5 cxd5 Nc3 Nf6 a4 Bd7 a5 b5 a6+ Kc6 Be5 Rae8 f4 Re6 Rec1 Kb6 Bd4+ Kc7 Nxb5+ Kb8 Nc7 Rc6 Rxc6 Bxc6 Bxf6 Kxc7 Bxg7 Rg8 Be5+ Kb6 Bd4+ Kb5 Ra5+ Kxb4 Ra1 Kc4 Bxa7 d4 Rc1+ Kd5 Rd1 Ke4 Rxd4+ Ke3 Bc5 Rxg2+ Kf1 Rf2+ Ke1 Rxh2 Kd1 Bf3+ Kc1 Rh4 Ra4+ Kd3 Ra3+ Ke2 Re3+ Kf2 Re5+ Kg3 Rg5+ Kh3 Bd6 Rg4 Rh5+ Kg3 f5+ Kf2 Rxh7 Rc4+ Kb2 Ke2 a7 Kd2 Rh2+ Kd1 Rf2 Ba8 f6 Rc6 Be7 Rb6+ Kc3 Ke1 Rf5 Ke2 f7,0.013632016
0.0040690955,-0.01541618,correct_chess,e4 d5 exd5 Qxd5 Nc3 Qe5+ Be2 Bg4 d4 Qe6 Be3 Nc6 Bxg4 Qg6 Bf3 Nb4 Be4 Qa6 Nb5 Qxb5 c3 Nd5 Bd3 Qxb2 Ne2 Nxc3 Nxc3 Qxc3+ Ke2 Qb2+ Kf3 O-O-O Qa4 e6 Qxa7 Qa3 Qxa3 Bxa3 Rab1 Nf6 Rb3 Bd6 Rhb1 b6 Bb5 Nd5 a4 Kb7 a5 c6 Bc4 b5 Bxd5 exd5 Bf4 Be7 Re3 Rhe8 Rbe1,-0.02188605
0.040614277,-0.015314133,correct_chess,e4 e5 Bc4 Nf6 d3 Bc5 Bg5 Bxf2+ Kxf2 Nxe4+ dxe4 Qxg5 Nf3 Qf6 Qd5 Nc6 Rf1 O-O Kg1 Nb4 Qxe5 Qxe5 Nxe5 Nxc2 Bxf7+ Kh8 Bc4 Rxf1+ Bxf1 Nxa1 Nc3 Nc2 Nd5 c6 Ne7 d6 Nf7#,0.009505865
-0.03164949,-0.0068704216,correct_chess,e4 e5 f4 d6 Nf3 Nc6 d4 exd4 Nxd4 Be7 Nxc6 bxc6 Bc4 Be6 Bxe6 fxe6 c4 Nh6 Nc3 O-O O-O e5 f5 Nf7 b4 Bg5 b5 Bxc1 Rxc1 Ng5 bxc6 a6 Re1 g6 fxg6 hxg6 Nd5 Ne6 Qg4 Qe8 Rf1 Nf4 Nxf4 Rxf4 Rxf4 exf4 Qxf4 Qxc6 Qf6 Qd7 c5 Rf8 Qxg6+ Kh8 cxd6 cxd6 Rd1 Rg8 Qf6+ Kh7 Rxd6 Qa7+ Kf1 Rg7 Qh6+ Kg8 Rd8+ Kf7 e5 Qc7 Qf6#,-0.018221911
0.04336521,-0.016641866,correct_chess,e4 e5 Nf3 Nc6 Bc4 Be7 d4 exd4 Nxd4 d6 Nc3 Nf6 Bg5 Nxd4 Qxd4 h6 Bh4 O-O O-O-O Bd7 Rhe1 Re8 Nd5 Nxd5 Qxd5 Bxh4 Qxf7+ Kh8 e5 Rf8 Qg6 Bxf2 Bd3 Kg8 e6 Bxe1 Qh7#,-0.0072176186
0.067828335,-0.0048446497,correct_chess,e4 d5 exd5 Qxd5 Nc3 Qe6+ Qe2 Nf6 Nf3 b6 d3 h6 Qxe6 Bxe6 Be2 Nbd7 O-O Bg4 Bf4 Rc8 Nb5 Nd5 Bg3 a6 Nbd4 f6 Rad1 c5 Nb3 Nb4 d4 c4 Nc1,-0.008029946
-0.053422764,0.0037843583,correct_chess,d4 d5 c4 dxc4 e4 g6 Bxc4 Bg7 Ne2 Nf6 Nbc3 O-O O-O e6 Be3 Nbd7 f3 Nb6 Bd3 a5 b3 c6 Kh1 Nbd7 Qd2 b5 a4 b4 Na2 Ba6 Nac1 Bxd3 Nxd3 Qc7 Bf4 Qb6 Rac1 Nh5 Bh6 Bxh6 Qxh6 Ng7 Rc4 e5 dxe5 Rfe8 f4 Qe3 Nec1 Nb6 Re1 Nxc4 Rxe3 Nxe3 Qh3 Nd1 Qf3 Nc3 f5 gxf5 exf5 Rad8 h3 c5 f6 Ne6 Nxc5 Kh8 N1d3 Rg8 Nxe6 fxe6 Nf4 Rde8 f7 Rgf8 fxe8=Q Rxe8 Qg4 Na2 Nxe6 Rg8 Qf5 h6 Qf6+ Kh7 Nf8+ Rxf8 Qxf8 Nc1 Qf7+ Kh8 e6,-0.02605752
-0.017175034,-0.016323265,correct_chess,e4 e5 Nf3 Qf6 d4 d6 d5 Bd7 Nc3 a6 Be3 Be7 Qd3 Nh6 Qc4 Bd8 O-O-O Ng4 Bg5 Qg6 Bxd8 Kxd8 Qe2 Qh6+ Kb1 Ke7 h3 Nf6 g4 g5 Bg2 Rc8 Nd2 c5 dxc6 Bxc6 Qe3 Nfd7 h4 b5 hxg5 Qf8 g6 hxg6 Qg5+ Nf6 Nf3 Qd8 Nxe5 Nd7 Nxg6+ Ke8 Rh8+ Nf8 Rxf8+ Kd7 Rxd8+ Rxd8 Qf5+ Kc7 Ne7 Bb7 Qxf6,-0.0034757017
-0.049849357,-0.0026624138,correct_chess,d4 e6 e3 c5 c3 d5 Bd3 c4 Bc2 b5 f4 Nc6 Nf3 a5 O-O Bb7 Nbd2 b4 Ne5 Bd6 Qf3 f5 Qh5+ g6 Nxg6 Nf6 Qh3 Rg8 Ne5 Qe7 Ndf3 O-O-O Rb1 Rg7 Ng5 Rdg8 Rf2 Ne4 Bxe4 fxe4 Qxe6+ Qxe6 Nxe6 Bxe5 Nxg7 Bxg7 Bd2 Bf6 g3 h5 Rbf1 h4 Kg2 hxg3 hxg3 Kc7 Rh1 Bc8 Rh6 Bg4 Rxf6 Bf3+ Rxf3 exf3+ Kxf3 b3 axb3 cxb3 e4 dxe4+ Kxe4 a4 Kf3 Na5 Rf5 Nb7 g4 Nd6 Rc5+ Kb6 c4 Rc8 Rxc8 Nxc8 Bb4,-0.028372614
0.038970016,-0.018944466,correct_chess,e4 g6 c4 Bg7 d4 b6 Nf3 c5 d5 Nf6 Nc3 O-O Bd3 e6 d6 Nc6 Nb5 Ba6 Nc7 Bb7 Nxa8 Qxa8 O-O Nd4 Ne5 Rd8 f3 Ne8 Qa4 Bxe5 f4 Bxd6 f5 exf5 exf5 Bxg2 fxg6 Bxf1 gxh7+ Kh8 Qc2 Nxc2,0.009391955
-0.06341027,0.016396528,correct_chess,c4 Nf6 Nf3 e6 e3 c5 Nc3 Nc6 Be2 b6 O-O Bb7 b3 Be7 Bb2 O-O Rc1 e5 d4 e4 Ng5 cxd4 exd4 d5 cxd5 Nxd5 Ngxe4 Nxc3 Bxc3 Nxd4 Qxd4 Qxd4 Bxd4 Bxe4 Rc7 Bd6 Rd7 Bf4 g3 Bf5 Rd5 Be6 Rb5 Bh6 Bf3 Rad8 Be5 Rd2 a4 g6 Kg2 Bg7 Bxg7 Kxg7 a5 Rb8 axb6 Rxb6 Rxb6 axb6 Rb1 Rd3 b4 b5 Be2 Bd5+ Kf1 Rc3 Bxb5 Be4 Re1 Bd5 Be2 Bc4 Bxc4 Rxc4 Rb1 Rc6 b5 Rb6 Ke2 Kf6 Kd3 Ke6 Kc4 Kd6 Rd1+ Kc7 Re1 Kd6 Kb4 h5 f4 f5 Re5 Kc7 Kc5,-0.008626952
0.010090628,-0.014813587,correct_chess,e4 e6 d4 d5 e5 c5 c3 Ne7 f4 Nbc6 Nf3 cxd4 cxd4 Nf5 g4 Nfe7 Nc3 Bd7 Bd3 Nb4 O-O Ng6 a3 Nxd3 Qxd3 Be7 f5 exf5 gxf5 Nf8 Nxd5 g5 f6 g4 fxe7 Qa5 exf8=Q+ Kxf8 Bh6+ Ke8 Nf6+ Ke7 Nd2 Be6 Bg5 Kf8 Nfe4 h6 Bh4 Qb6 Nc5 Bd5 b4 Rc8 Nd7+,-0.006666832
-0.00749964,-0.01906355,correct_chess,e4 d6 d4 c6 c4 b5 d5 cxd5 cxd5 Bd7 Qb3 Qa5+ Bd2 Qb6 Na3 a6 Nc4 Qd4 Nf3 Qxe4+ Ne3 e6 Bd3 Qe5 Nxe5 dxe5 O-O exd5 Nxd5 Nc6 Bxb5 Nd4 Nc7+ Kd8 Qd5 Kxc7 Qxd7+ Kb6 Rfe1 axb5 Rxe5 Nc6 Re8 Ra7 Be3+ Ka6 Qxc6+ Ka5 Bxa7 Ne7 Qb6+ Ka4 b3+ Ka3 Qxb5 Ng6 Bd4 Nf4 Qa4#,-0.015408334
-0.050298825,0.0037959109,correct_chess,d4 c5 c4 cxd4 Qxd4 Nc6 Qd1 g6 a3 Bg7 Nf3 d6 Bg5 Nf6 Nc3 Qb6 Qc2 O-O e3 Bf5 Bd3 Bxd3 Qxd3 Qxb2 O-O Qb6 Nd5 Nxd5 Rab1 Qa6 Qxd5 Rac8 Nd4 Nxd4 exd4 Qxc4 Qxc4 Rxc4 Bxe7 Re8 Bxd6 Bxd4 Rbd1 Bb6 Bb4 Re2 h3 Rcc2 Be1 Ra2 Rd7 Rxa3 Rxb7 Raa2 Rb8+ Kg7 Bc3+ Kh6 Be1 f5 Rf8 Kg7 Re8 g5 Rxe2 Rxe2 g3 Kf6 Kg2 h5 Bc3+ Ke6 Re1 Rxe1 Bxe1 Ke5 f3 Bd4 Bd2 a6 f4+,-0.04585608
-0.059938774,0.010865137,correct_chess,e4 e5 Nf3 Nc6 Bc4 Nf6 d3 h6 O-O Bc5 h3 d6 Nc3 Nd4 Nd5 Nxd5 exd5 c6 a3 cxd5 Bxd5 Be6 Bxb7 Rb8 Ba6 O-O c3 Nf5 d4 exd4 cxd4 Bb6 Be3 d5 Ne5 Nxe3 fxe3 Qg5 Qf3 f6 Ng4 Bc7 b4 Bxg4 hxg4 Qh4 Qxd5+ Kh8 Qh5 Qg3 Qh3 Rbe8 Qxg3 Bxg3 Rf3 Bh4 g3 Bg5 Re1 Re6 Bd3 Rfe8 e4 Rc8 e5 Bd2 Re2 Bc3 exf6 Bxd4+ Kh2 Rxe2+ Bxe2 Bxf6 a4 Rc2 Rf2 Bd4 Rf8+ Kh7 Re8 Bc3 Kh3 Bxb4 Bd3+ g6 Bxc2 a5 Kh4 Kg7 g5 h5 g4 hxg4 Kxg4 Kf7 Rc8 Bd2,-0.017521426
-0.062512405,0.016972028,correct_chess,e4 e5 d4 Qf6 dxe5 Qxe5 Qe2 Nf6 Nf3 Qxe4 Qxe4+ Nxe4 Nbd2 Nxd2 Bxd2 g6 Bc3 Rg8 Ng5 Bg7 Bxg7 Rxg7 O-O-O b6 Re1+ Kf8 Be2 Bb7 Bf3 Bxf3 Nxf3 f6 Nd4 Nc6 Nxc6 dxc6 Re6 Re8 Rxf6+ Kg8 Rxc6 Re2 Rf1 Rd7 b3 Rdd2 Rd1 Rxd1+ Kxd1 Rxf2 Rxc7 Rxg2 Rxa7 Rxh2 Rb7 g5 Rxb6 g4 Rb4 g3 Rg4+ Kh8 Rxg3 Rh1+ Kd2 h5 c4 h4 Re3 h3 c5 Kg7 c6 Kg6 c7 Kg5 c8=Q h2 Qh3 Kf6 Qf3+ Kg6 Qxh1 Kf5 Qxh2 Kf6 Qf2+ Kg5 Rg3+ Kh4 Qh2#,0.013808794
0.030714253,-0.027420871,correct_chess,e4 g6 d4 Bg7 c3 e6 Bd3 f5 exf5 gxf5 Nf3 Qf6 Bg5 Qg6 O-O h6 Bf4 Nf6 Bxc7 Nc6 Be5 O-O Nh4 Qg5 Nf3 Qh5 Be2 Ng4 Bg3 Rf6 Be5 Rg6 Bxg7 Rxg7 h3 Nf6 Ne5 Qe8 Nxc6 dxc6 Bf3 Nd5 c4 Bd7 c5 b6 Bxd5 Rb8,0.0034309702
-0.050999887,-0.00017425675,correct_chess,e4 e5 Bc4 c6 Nf3 d5 exd5 cxd5 Bb3 Nc6 Ba4 Bd6 O-O e4 Re1 Nf6 d3 O-O dxe4 dxe4 Nd4 Qc7 g3 a6 Bxc6 bxc6 Bg5 Be5 Bxf6 Bxf6 Nb3 Bxb2 N1d2 Rd8 Rb1 Qe5 Rxe4 Qxe4 Nxe4 Rxd1+ Rxd1 Bf5 Nd6 Bxc2 Rd2 Bxb3 Rxb2 Bd5 Nf5 g6 Ne7+ Kg7 Nxd5 cxd5 Kg2 d4 Rc2 d3 Rd2 Rd8 Kf3 a5 Ke3 Re8+ Kxd3 Re1 Kc2 Rh1 f3 h5 h4 Kh6 Rd5 Rg1 Rxa5 Rxg3 Ra3 g5 hxg5+ Kxg5 Rd3 h4 f4+ Kxf4 Rxg3 Kxg3,-0.024745103
0.009171482,-0.016268142,correct_chess,e4 c5 Nf3 d6 h3 Nc6 d4 cxd4 Nxd4 e5 Nxc6 bxc6 Nc3 Nf6 Bc4 Rb8 Rb1 Nxe4 Nxe4 d5 Bxd5 cxd5 Nc3 Bb7 O-O Qd7 f4 d4 Ne2 Qd5 Kf2 f6 fxe5 fxe5 Ke1 Bb4+ c3 d3 cxb4 Qxg2 Qxd3 Be4 Qd6 Rd8 Qxe5+ Kd7 Rf7+ Kc8 Qc7#,0.0054097804
0.12554698,0.04637091,correct_chess,e4 d5 e5 d4 Nf3 Nc6 c3 d3 Na3 f6 exf6 Nxf6 Qa4 Qd5,-0.012740864
-0.045379154,0.007419169,correct_chess,e3 d5 b3 e5 Bb2 Qg5 g3 Nf6 Bh3 Nc6 Qf3 Bb4 c3 O-O Ne2 Bg4 Qg2 Bxe2 Kxe2 Bxc3 Bxc3 d4 Ba5 Rae8 Bxc7 dxe3 dxe3 Qxe3+ Kxe3 Nd4 Qxb7 Nc2+ Kf3 Nxa1 Bd6 e4+ Kg2 Nc2 Bxf8 Kxf8 Rc1 Ne3+ Kg1 Kg8 Qxa7 h6 Qxe3 Ng4 Bxg4 g6 Rc7 f5 Qa7 h5 Rg7+ Kf8 Rf7+ Kg8 Rg7+ Kf8 Be2 f4 Bc4 e3 Rf7+ Kg8 Qc5 exf2+ Kxf2 Kh8 Qc7 fxg3+ Kxg3 Kg8 Rg7+ Kf8 Rg8#,0.0047858367
-0.04291152,0.0015146818,correct_chess,d4 b6 c4 e6 Nc3 Bb7 a3 g6 h3 Bg7 Nf3 Bxf3 exf3 Qf6 Be2 Qxd4 Qxd4 Bxd4 O-O Bxc3 bxc3 Ne7 Bd3 f5 Be3 c5 Rab1 Nbc6 Bh6 Na5 a4 Nec6 g4 Ne5 Be2 O-O-O Bg7 Rhg8 Bxe5 d6 Bf6 Rdf8 g5 e5 Rbd1 Kc7 Rd3 f4 Rfd1 Nb7 R3d2 Rf7 Bd3 Na5 Kf1 Nb3 Re2 Na5 Be4 Nxc4 Bd5 Rxf6 Bxg8 Rf5 Bxc4 Rxg5 Red2 Rf5 Rxd6 e4 Rd7+ Kb8 Rd8+ Kc7 R1d7+ Kc6 Bb5#,-0.03861479
0.015689114,-0.025378672,correct_chess,d4 d5 Nf3 Nf6 e3 Bf5 Nh4 Bg6 Nxg6 hxg6 Bd3 e6 Qe2 Bd6 Nd2 c5 c3 c4 Bc2 Nc6 e4 dxe4 Nxe4 e5 Nxf6+ gxf6 Qxc4 Qc7 Bb3 Na5 Ba4+ Nc6 d5 a6 dxc6 b5 Bxb5 axb5 Qxb5 Rb8 Qa6 Kf8 Be3 Kg7 O-O-O Ra8 b4 Rxa6,0.0055063907
0.10751685,0.025689548,correct_chess,e4 e5 Nf3 Nc6 Bc4 Bc5 b4 Bxb4 c3 Bc5 O-O d6 d4 Bb6 Ba3 exd4 cxd4 Bg4 Nc3,-0.0064313808
-0.09726266,0.04599847,correct_chess,e4 c6 Nf3 d5 exd5 cxd5 d4 Nc6 Nc3 e6 Be2 Bd6 O-O Nf6 Bg5 O-O Qd2 Be7 Rfe1 Qc7 Bf4 Qd7 Bb5 a6 Ba4 b5 Bb3 Qa7 Nh4 Qd7 Bh6 gxh6 Qxh6 Ne4 Nxe4 dxe4 Rxe4 f5 Rxe6 Kh8 Nxf5 Rxf5 Rae1 Bf8 Qh3 Rg5 R1e4 Qg7 g3 Bxe6 Bxe6 Re8 d5 Ne5 f4 Nf3+ Kh1 Rg6 f5 Rg5 Kg2 Nd4 c3 Nxe6 dxe6 Bd6 g4 Qf6 Qd3 Bb8 Qd7 Qh6 e7 Qxh2+ Kf3 Qg3+ Ke2 Qg2+ Kd1 Qxe4 Qxe8+ Rg8 Qf7 Qxg4+ Kc2 Qg2+ Kb3 a5 e8=Q a4+ Ka3 Bd6+ b4 axb3+ Kxb3 Rxe8 Qxe8+ Kg7 Qd7+ Kh6 Qxd6+ Kg5 f6 Qf3 Qe5+ Kg6 Qxb5 Qxf6 a4 Qe6+ Ka3 Qd6+ Qb4 Qd3 a5 h5 Qb6+ Kg5 Qc5+ Kg4 Kb4 Qb1+ Kc4 Qa2+ Kd3 Qb1+ Kc4 Qa2+ Kd4 Qd2+ Kc4 Qa2+ Kb5 Qb3+ Qb4+ Qxb4+ Kxb4 h4 a6 h3 a7 h2 a8=Q h1=B Qxh1 Kf4 c4 Kg3 Qe1+ Kf3 Qd2 Ke4 Qc3 Kf4 Qd3 Ke5 c5 Ke6 c6 Ke5 c7 Ke6 Qd4 Ke7 c8=Q Kf7 Qd6 Kg7 Qcc7+ Kg8 Qdd8#,0.024872039
-0.07547519,0.022345984,correct_chess,e4 e6 b3 d6 Bb2 e5 g3 Nf6 Bh3 Bxh3 Nxh3 Nxe4 f3 Nc5 d4 exd4 Bxd4 Qe7+ Qe2 Qxe2+ Kxe2 Ne6 Bc3 Nc6 Re1 Ncd4+ Bxd4 Nxd4+ Kd3+ Ne6 Nf4 Kd7 Nc3 Ng5 Re3 g6 h4 Ne6 Nxe6 fxe6 Ne4 Bg7 Rd1 Rhf8 f4 b6 Ng5 e5 fxe5 Bxe5 Nxh7 Rf2 Ng5 Rg2 Ne4 Rf8 Kc4 Rxc2+ Kd3 Rxa2 Kc4 Rc2+ Nc3 a6 Kd3 Rxc3+ Ke4 Rxe3+ Kxe3 Bxg3 Rh1 c5 h5 g5 h6 Bh4 Ra1 a5 Ke4 Rh8 Kf5 Rxh6 b4 cxb4 Ke4 Re6+ Kd5 Re5+ Kc4 b5+ Kb3 Re3+ Ka2 a4 Rd1 g4 Rg1 g3 Rg2 Rf3 Rg1 Rf2+ Kb1 g2 Rxg2 Rxg2,-0.0026551653
0.007248228,-0.013143879,correct_chess,e4 Nf6 Nf3 Nxe4 Nc3 Nxc3 dxc3 e6 Bg5 Be7 h4 O-O Bc4 d5 Bd3 c5 b3 Nc6 Qd2 e5 Be2 e4 Nh2 h6 Bxe7 Qxe7 O-O-O Be6 Bg4 Rad8 Qe2 Qxh4 Bxe6 fxe6 Ng4 Qg5+ Kb2 Ne5 Nxe5 Qxe5 f3 d4 fxe4 dxc3+ Kb1 Qc7 Qe3 Qa5 Rde1 b5 Qxc5 Rc8 Qd4 Qa3,-0.000706137
-0.050116632,-0.0062806397,correct_chess,Nc3 c5 d3 g6 e4 Bg7 f4 Nc6 Nf3 e6 Be3 Nge7 Qe2 Qb6 Na4 Qa5+ Nc3 d6 Bd2 b5 Nd5 Qd8 Nxe7 Qxe7 O-O-O b4 d4 Nxd4 Nxd4 Bxd4 Qb5+ Bd7 Qb7 O-O Bb5 Rfd8 Bxd7 Qxd7 Qxd7 Rxd7 c3 bxc3 Bxc3 Bxc3 bxc3 Rad8 Kc2 d5 e5 d4 c4 Rb8 Rb1 Rdb7 Rxb7 Rxb7 Rc1 Kf8 Kd3 Ke7 Rc2 Kd7 Ke4 Ke7 g4 f6 exf6+ Kxf6 h4 h6 g5+ hxg5 hxg5+ Ke7 Ke5 Rb1 Re2 d3 Rd2 Re1+ Re2 Rxe2#,-0.04102712
-0.012879084,-0.014752269,correct_chess,d4 Nc6 e3 d5 Bd3 Bf5 Bd2 e6 Nf3 Bxd3 cxd3 Bb4 e4 Bxd2+ Kxd2 dxe4 dxe4 Nxd4 Nc3 Nxf3+ Ke2 Nd4+ Ke3 Nc2+ Qxc2 Qd6 Qa4+ c6 Qb3 O-O-O Rad1 Qc5+ Rd4 Qxd4+ Kf3 Qf6+ Ke3 g5 f3 Qf4+ Ke2 Qd2+ Kf1 Qc1+ Kf2 Qd2+ Kg3 Qf4+ Kf2 Rd2+ Kf1 Qe3 Qb4 Qf2#,0.0070276037
-0.08796084,0.035684485,correct_chess,e3 d5 b3 e5 Bb2 Nf6 g3 Nc6 Bg2 Bf5 Na3 Bd6 Nb5 O-O c4 dxc4 bxc4 a6 Nc3 Bc5 Nf3 Bd3 Ng5 e4 Nd5 h6 Nh3 Kh8 Bc3 Bb4 Bxb4 a5 Bxf8 Qxf8 Nxc7 Qb4 Nxa8 Qxc4 Rc1 Ng4 Rxc4 Bxc4 Nc7 Nce5 Ne8 Nd3+ Kf1 Nb2+ Kg1 Nxd1 Bxe4 Ndxf2 Bf5 Bd5 Nd6 Bxh1 Nxf7+ Kg8 Be6 Nxh3+ Kxh1 Nhf2+ Kg2 Kf8 Kf3 h5 Kf4 Nd3+ Kg5 Nc5 Kxh5 Nxe6 Kxg4 Kxf7 d4 Ke7 d5 Nc5 Kf4 Nd3+ Ke4 Nc1 Ke5 Kd7 d6 Nxa2 h4 Nc3 g4 Ne2 g5 a4 h5 a3 h6 gxh6 gxh6 a2 h7 a1=Q+ Kf5 Qe5+ Kg6 Qg7+ Kxg7 Nf4 h8=Q Kxd6 Qh4 b6 Qxf4+ Kc6 Qb4 b5 e4 Kd7 e5 Kd8 Qe4 b4 Qxb4 Ke8 e6 Kd8 Qe4 Ke8 e7 Kd7 e8=Q+ Kc7 Q4e6 Kb7 Q8e7+ Kb8 Qg8#,0.02013643
0.030817777,-0.014120536,correct_chess,e4 e5 Nf3 Nc6 Bc4 Nf6 d4 d5 dxe5 Nxe4 Bb5 Bd7 e6 Bxe6 Bxc6+ bxc6 Kf1 Bc5 Ne5 Nxf2 Qe2 Nxh1 Nxc6 Qd6 Qb5 Qf4+ Bxf4 O-O Qxc5 Rae8 Nc3 Bf5 Re1 Re6 Rxe6 Bxe6 Ne7+ Kh8 Qxc7 Rc8,0.002993359
-0.0059451256,-0.016031664,correct_chess,c4 d6 e4 Nf6 Nc3 e5 Nf3 Be6 d3 Be7 h3 c5 Be2 Nc6 a3 Qa5 Bd2 Qb6 Rb1 Nd4 Nxd4 exd4 Nd5 Nxd5 exd5 Bd7 Bg4 f5 Bh5+ g6 Bf3 O-O-O Qe2 Rhe8 O-O Bg5 Qd1 f4 a4 Bh6 a5 Qc7 Qc2 Bf5 b4 g5 b5 b6 axb6 axb6 Ra1 Kd7 Ra6 Ra8 Qa4 Bxd3 Rxa8 Rxa8 Qxa8 Bxc4 Re1 Bxb5 Qe8#,-0.020690888
-0.003957099,-0.014923307,correct_chess,d4 d5 c4 Bf5 Bf4 dxc4 e3 e6 Bxc4 Bd6 Qa4+ c6 Bxd6 b5 Qb4 bxc4 Bf8 Ne7 Bxg7 Rg8 Bf6 Rg6 Bxe7 Qc7 Bf8 Na6 Qa3 Rb8 Nd2 Nb4 O-O-O e5 Nxc4 Kxf8 Nd6 Qxd6 Qxa7 Rxg2 Nh3 Rxf2 Nxf2 Bg6 Ng4 h6 Nxh6 Bh5 Rhg1 Bxd1 Rf1 exd4 Qxf7#,-0.004153208
-0.014032085,-0.017944492,correct_chess,e4 c5 Nf3 Nc6 Bb5 d6 c3 Bd7 d4 cxd4 cxd4 Qa5+ Nc3 Rc8 d5 Nb8 Bxd7+ Nxd7 Bd2 Ngf6 Qc2 Qa6 Nd4 g6 Qb3 Bg7 Ndb5 O-O O-O Ne8 Rac1 Nc7 Nxc7 Rxc7 Na4 Rxc1 Rxc1 b5 Nc3 Qb7 Nxb5 Rc8 Nxa7 Rxc1+ Bxc1 Qxa7 Be3 Qa5 h3 Be5 Kf1 Nc5 Qb8+ Kg7 a3 Nd3 b4 Qa4 Ke2 Qc2+ Bd2 Bc3,-0.012815925
-0.08347862,0.03633563,correct_chess,e4 e6 d4 d5 e5 c5 c3 Ne7 f4 Nbc6 Bb5 Bd7 Bxc6 Bxc6 Nf3 cxd4 cxd4 Nf5 Nc3 Bb4 O-O O-O g4 Nh4 a3 Nxf3+ Qxf3 Bxc3 bxc3 Rc8 Bd2 Bb5 Rf2 Bc4 f5 a5 g5 b5 h4 exf5 Qxf5 Qe7 h5 Rc6 h6 gxh6 gxh6 Rg6+ Kh1 Qh4+ Rh2 Qg3 Qf2 Qd3 Rg1 Qc2 Rhg2 Bd3 Rg3 f6 Rxg6+ hxg6 e6 Be4+ Kh2 Bf5 e7 Re8 Qe2 Rxe7 Qxe7 Qxd2+ Rg2 Qxh6+ Kg1 Qf8 Qb7 Qd6 Qa8+ Kf7 Qb7+ Qd7 Qb6 Be4 Rf2 Qg4+ Kf1 Qh3+ Ke1 Qe3+ Kf1 Bd3+ Kg1 Qg3+ Rg2 Qe1+ Kh2 Qh4+ Kg1 Qe1+ Kh2 Qh4+ Kg1 Qe1+ Kh2 Qh4+ Kg1 Qe1+,0.017502755
0.031262297,-0.018873785,correct_chess,e4 c6 Nf3 d5 exd5 cxd5 d4 Nc6 Nc3 Bf5 Bg5 Nf6 Bb5 a6 Ba4 b5 Bb3 e6 O-O Bd6 Qe1 h6 Bh4 O-O Ne5 Nxd4 Rd1 Nxb3 cxb3 Be7 Nc6 Qc7 Nxe7+ Qxe7 Nxd5 Nxd5 Rxd5 Qxh4 Rd7 e5 Qxe5 Bxd7,0.007559919
0.023818942,-0.0234901,correct_chess,d4 d6 e4 Nd7 Bb5 c6 Bc4 e5 d5 Ngf6 Bg5 h6 Bh4 c5 Qf3 a6 a4 Qb6 b3 Qa5+ Nd2 b5 Be2 Be7 Bxf6 Bxf6 Qh3 Bg5 Nf3 Nf6 Qg3 Nxe4 Rd1 Nxg3 fxg3 Be3 Nh4 bxa4 Nf5 Bxf5 bxa4 Bxc2 Ra1 Qxd2+ Kf1 Bd3 Re1 Rb8,-0.015360933
0.032978762,-0.023186656,correct_chess,e4 c5 Nf3 g6 Bc4 Bg7 O-O e6 d4 Ne7 d5 exd5 exd5 d6 Re1 O-O Bg5 f6 Bf4 g5 Bg3 Nf5 h4 Nxg3 fxg3 h6 Qd3 Nd7 Qg6 Ne5 Rxe5 fxe5 hxg5 Bf5 Qh5 e4 gxh6 exf3 hxg7 f2+ Kf1 Rf7 Nc3,-0.0013263745
0.019970205,-0.022929199,correct_chess,d4 e5 c4 exd4 Qxd4 Nc6 Qd1 d6 Nc3 Nf6 Nf3 Be7 a3 Bf5 Bg5 O-O e3 d5 cxd5 Nxd5 Nxd5 Bxg5 Nxg5 Qxg5 Nxc7 Rad8 Nd5 Be4 Bc4 Bxd5 Qc2 Qxg2 O-O-O Be4 Bd3 Bxd3 Rxd3 Qxh1+ Rd1 Rxd1+ Qxd1 Qxd1+,0.0031933717
0.0812449,-0.010787764,correct_chess,e4 d5 e5 d4 d3 Qd5 Nf3 h6 c3 dxc3 Nxc3 Qc6 d4 Bg4 Be2 Qg6 Nd5 Na6 Nh4 O-O-O Nxg6 fxg6 Bxg4+,0.02092919
0.03625045,-0.019690545,correct_chess,e4 c5 c3 g6 d4 cxd4 cxd4 Bg7 Nf3 e6 Nc3 Ne7 Bc4 a6 O-O b5 Bb3 Bb7 Be3 d5 e5 b4 Ne2 a5 Ba4+ Nd7 Qd3 Ba6 Bb5 Bxb5 Qxb5 O-O a3 Nf5 axb4 Nxe3 fxe3 Nb6 bxa5 Nc4 a6 Qd7 Qxd7,0.0112282885
-0.022440137,-0.0010178721,correct_chess,e4 Nc6 d4 e5 d5 Nce7 Nc3 Ng6 Bd3 Bb4 a3 Bxc3+ bxc3 d6 Be3 Nf6 c4 Bd7 Nf3 Bg4 O-O Qd7 Be2 Nf4 Bxf4 Nh5 h3 Bxh3 Bxe5 Bxg2 Bxg7 Bxf1 Bxf1 Qg4+ Bg2 Qxg7 Rb1 Nf4 Nh4 O-O-O Qf3 Nxg2 Nxg2 Rhg8 Kf1 Qd4 Qh3+ Kb8 Qxh7 Qxc4+ Ke1 Qxc2 Rd1 Rxg2 Qxf7 Rg1#,0.0139880795
-0.06779136,0.011836156,correct_chess,e4 e5 d4 exd4 Qxd4 Nc6 Qe3 Nf6 Nc3 a6 Nd5 h6 Nxf6+ Qxf6 Bd2 Be7 Bc3 Qg6 Rd1 O-O g3 Bb4 Bd3 Bxc3+ bxc3 Qf6 Bc4 d6 f3 b5 Bd5 Bb7 Nh3 Rab8 Bxc6 Bxc6 Nf4 b4 Nh5 Qe5 Nf4 bxc3 Ne2 Rb2 Nxc3 Rxc2 Rc1 Rxc1+ Qxc1 Bd7 Nd5 c6 Nb6 Qa5+ Kd1 Qxb6 Qd2 Qb1+ Qc1 Qxc1+ Kxc1 c5 Rd1 Bh3 Rxd6 Bg2 Rd3 c4 Rc3 Rc8 Kd2 Bf1 Ke1 Bd3 e5 Rc5 f4 g5 Kf2 Kg7 Kf3 Kg6 fxg5 hxg5 g4 Rxe5 a3 f6 h3 f5 gxf5+ Kxf5 Kg3 Re3+ Kh2 Kf4 Kg2 Rg3+ Kh2 Kf3,-0.006074335
0.06292521,-0.018128071,correct_chess,e4 c5 Nf3 d6 Nc3 Nc6 d4 cxd4 Nxd4 g6 Be3 Bg7 Bc4 Nf6 Bb3 O-O Qd3 Nb4 Qe2 Ng4 O-O-O a5 h3 Nxe3 Qxe3 Bd7 a3 Nc6 Nxc6 Bxc6 f4 b5 Rhe1 b4,0.014374452
0.015847337,-0.012760562,correct_chess,d4 b6 e3 Bb7 Bd3 a6 Nf3 g6 e4 c6 d5 b5 dxc6 Bxc6 e5 e6 Ng5 f6 f3 fxg5 Be4 Bxe4 fxe4 g4 Qd6 Bxd6 exd6 h5 Rf1 h4 Rf4 h3 gxh3 g3 hxg3 Rxh3 Rg4 Rh1+ Kf2 Qb6+ Kf3 Rf1+ Kg2 Qg1+ Kh3 Qh1#,0.00585066
-0.02959738,0.0034101142,correct_chess,b3 d5 Bb2 e5 a4 f5 a5 c5 a6 bxa6 e3 d4 exd4 cxd4 Bd3 e4 Bf1 d3 cxd3 exd3 Bxd3 Qxd3 Qe2+ Kd7 Qxd3+ Ke7 Qe3+ Kd7 Qd3+ Ke7 Ba3+ Kf6 Qc3+ Kg5 Bxf8 Nf6 Bxg7 Bb7 Qxf6+ Kf4 Qe5+ Kg4 Bxh8 Bxg2 h3+ Kh4 Qg3+ Kh5 Qxg2 a5 Qxa8 Nd7 Qxa7 Nf6 Qf7+ Kg5 h4+ Kg4 f3+ Kf4 Kf2 Nd5 Ne2#,0.017783394
0.067950696,0.012475314,correct_chess,e4 e5 Nf3 d6 Bc4 Nf6 Nc3 h6 d4 Be7 dxe5 dxe5 Qxd8+ Bxd8 Nxe5 Nbd7 Nxf7 Rf8 Nxd8 Kxd8 O-O Ne5 Bb3 Bg4 Bf4 Re8 f3 Bh5 Rad1+ Ke7 Bxe5,-0.025127457
-0.06497479,0.00855724,correct_chess,d4 d5 c4 e6 c5 c6 b4 a5 a3 axb4 e3 Qa5 Bd2 Nd7 Bxb4 Qa7 Nf3 Ngf6 Be2 h6 O-O b6 cxb6 Qxb6 Bxf8 Nxf8 Nc3 N8d7 Rb1 Qc7 Rb3 Ng4 g3 g5 Qd2 Ndf6 Ne1 e5 dxe5 Qxe5 Qd4 Qxd4 exd4 Ne4 Nxe4 dxe4 Bxg4 Bxg4 Ng2 Be6 Rb7 Rxa3 Rb8+ Ke7 Rxh8 Bc4 Rc1 Bd5 Ne3 Bb3 Rxc6 Ra1+ Kg2 Ba4 Rcxh6 Bb5 Rh5 g4 Re5+ Kd6 Rxb5 Ke6 Rh6+ Ke7 Re5+ Kd7 Rxe4 f5 Re5 Ra8 Rxf5 Ke7 Rb5 Kd7 Rbb6 Rc8 Nxg4 Ke7 Rb7+ Kd8 Rh8#,-0.020957367
-0.067203484,0.011062455,correct_chess,e4 c5 f4 d5 exd5 Qxd5 Nc3 Qd8 d3 e6 Be3 Nf6 Be2 b6 Qd2 Nc6 O-O-O Bd7 d4 cxd4 Bxd4 Nxd4 Qxd4 Be7 Bb5 Bxb5 Qxd8+ Rxd8 Rxd8+ Bxd8 Nxb5 a6 Nd6+ Ke7 Nc4 b5 Ne3 Rg8 Ne2 Bb6 Nd1 g5 f5 e5 Re1 Nd7 g4 f6 h3 h6 Ne3 Bxe3+ Kb1 Nc5 Nc3 Bd4 Nd5+ Kd6 Nxf6 Rf8 Nh5 Bf2 Re2 Bh4 b3 e4 Ng7 Kd5 Rd2+ Ke5 b4 Be1 Re2 Bxb4 Kb2 a5 a3 Na4+ Kb3 Bc3 Re3 Rc8 Ne6 Rc4 Rxc3 Rxc3+ Ka2 Rxc2+ Kb1 Rh2 Kc1 Rxh3 Nf8 Rxa3 Ng6+ Kf6 Nf8 Ra2 Nd7+,-0.025978014
-0.036685333,-0.0059963795,correct_chess,e4 c5 Nf3 e6 Be2 d5 exd5 exd5 d4 Nf6 dxc5 Bxc5 O-O Be7 h3 O-O Bf4 Nc6 c3 Bd6 Bxd6 Qxd6 Nbd2 Bf5 Nb3 Bg6 Bd3 Nh5 Nbd4 Nxd4 cxd4 Be4 Bxe4 dxe4 Ne5 Nf4 Qg4 Ne6 Rad1 f6 Nc4 Qd5 Ne3 Qg5 Qxe4 Nf4 d5 Nxh3+ Kh2 Nf4 g3 Qh5+ Kg1 Nh3+ Kg2 f5 Qh4 Qxh4 gxh4 Nf4+ Kf3 Nh5 Rg1 g6 d6 Nf6 d7 Rad8 Nc4 Rxd7 Rxd7 Nxd7 Rd1 Nc5 Rd5 Ne6 Rd6 Nc7 Rd7 Nb5 Nd6 Nd4+,-0.018467885
0.03215653,-0.023487091,correct_chess,e4 e5 Nf3 Nc6 Bc4 Nf6 d3 d6 Bg5 Be7 c3 Bg4 h3 Be6 Bxe6 fxe6 Qb3 Qd7 Qxb7 O-O Qb3 Rab8 Qc2 d5 Nbd2 h6 Bxf6 Rxf6 O-O d4 c4 Qe8 Rfe1 Qg6 b3 Bb4 Qd1 Bc3 Rc1 Rbf8 Nh4 Qg5 g3 Qxd2,0.00011468152
0.033917043,-0.023483437,correct_chess,e4 d5 e5 e6 d4 Ne7 Nf3 Ng6 Bb5+ c6 Bd3 Be7 Bxg6 fxg6 Nc3 O-O O-O c5 dxc5 Bxc5 Bg5 Qb6 a3 Qxb2 Na4 Qb5 Nxc5 Qxc5 Be3 Qc7 Rc1 Nc6 Bc5 Rf5 Bd6 Qf7 Qd3 a5 Rce1 b6 Nh4 Rh5 g3 Ba6 Qc3 Nd8,0.0042602355
0.0704,-0.016332913,correct_chess,e4 c5 d4 cxd4 c3 dxc3 Nxc3 d6 Nf3 g6 Bc4 Bg7 Bf4 Nf6 Rc1 O-O O-O Nc6 a3 a6 b4 Bd7 Qb3 b5 Bxf7+ Rxf7 Ng5 e6 Bxd6,0.019060582
-0.032667197,-0.0024480454,correct_chess,d4 b6 e4 Bb7 c4 a6 f4 e6 d5 exd5 exd5 g6 Qe2+ Qe7 f5 gxf5 Qxe7+ Bxe7 Bd3 Kd8 Bxf5 c6 dxc6 Bxc6 Bf4 Bxg2 Be4 Bxe4 Nf3 Bxf3 Rf1 Bb7 h3 Bf6 h4 Bxb2 Nc3 Bxc3+ Kd1 Bxa1 Ke2 a5 Rxa1 Ba6 Rc1 b5 cxb5 Bxb5+ Kd2 h5 Rb1 Bc6 Rb4 Na6 Rc4 Rc8 Rd4 d5 Bd6 Nf6 Rf4 Ne4+ Kd3 Re8 Rf6 Ng3 Rxf7 Re3+ Kc2 Bb5+ Kd2 Rcc3 Kd1 Re2,-0.021064045
-0.019818088,-0.01693584,correct_chess,Nf3 b6 d4 Bb7 c4 g6 Nc3 Bg7 e4 e6 d5 Ne7 Bd3 exd5 exd5 c6 Be4 cxd5 Bxd5 Bxd5 cxd5 d6 O-O Nd7 Re1 O-O a3 Be5 Rb1 Bxc3 bxc3 Rc8 c4 Nc5 Bd2 Nf5 Bf4 Qd7 Qc2 Rfe8 Ng5 Rxe1+ Rxe1 Re8 Rxe8+ Qxe8 g3 h6 Nh3 Kg7 Bxd6 Ne4 Qb2+ Kg8 Be5 f6 Bxf6 Kf7 Ng5+ hxg5 Bg7 Nxg7 f3 Nf6 Kg2 Qe3 Kh3 g4+,-0.011719192
-0.05190839,0.015300572,correct_chess,e4 g6 Nf3 e6 d4 Bg7 Bc4 Ne7 Nc3 O-O O-O f6 e5 f5 Bg5 c6 Qd2 Qe8 Bxe7 Qxe7 Ng5 h6 Nh3 g5 f4 g4 Nf2 d6 h3 gxh3 gxh3 d5 Be2 Kh8 Kh2 Rg8 Bh5 Nd7 Rg1 c5 Rg6 cxd4 Qxd4 Nc5 Rag1 Ne4 Nfxe4 fxe4 Nb5 Bd7 Nd6 Rac8 c3 Rcf8 Qe3 Qh4 Be2 Qxf4+ Qxf4 Rxf4 Rxg7 Rxg7 Rxg7 Kxg7 Bg4 b6 Kg3 Rf3+ Kh4 Kg6 Ne8 h5 Nf6 Rxf6 exf6 Kxf6 Bxe6 Ke5 Kxh5 Bxe6 Kg6 Bd7 h4 Bh3 h5 Bg4 h6 Bf5+ Kg7 Bh7 Kxh7 Kf4 Kg7 e3 h7 e2 h8=Q e1=Q Qh4+ Kf3 Qxe1,0.0062554795
-0.0029759721,-0.01652681,correct_chess,e4 e6 d4 d5 e5 c5 c3 Nc6 f4 Nge7 g4 cxd4 cxd4 Qb6 Nf3 Ng6 Be3 Bb4+ Nc3 Bd7 Bd3 Rc8 Bxg6 fxg6 a3 Bxc3+ bxc3 Na5 Rb1 Qc7 Rc1 Nc4 Qe2 O-O Ng5 a6 a4 Qa5 O-O h6 Nf3 Bxa4 Ra1 b5 Rfc1 Qb6 Bf2 Rxf4 Nh4 Kh7 Qd3 Rcf8 Qxg6+ Kg8 Qxe6+ Qxe6,0.0009988371
0.06926877,-0.010874584,correct_chess,e4 e5 Nf3 Nc6 Bc4 h6 d4 exd4 Nxd4 Bc5 Nf5 Qf6 Nc3 Nge7 Bf4 d6 Nd5 Nxd5 Bxd5 O-O Nxh6+ gxh6 Qd2 Qxb2 Kf1 Qxa1+ Ke2 Qd4 Qe1,0.017310744
-0.0008165507,-0.018057125,correct_chess,e4 e5 Nf3 Nf6 d4 d6 dxe5 dxe5 Bd3 Bc5 O-O O-O Nc3 Bg4 Be3 Bxe3 fxe3 Nc6 Qe1 Qe7 Nd5 Qd8 Rd1 Be6 Ng5 Bxd5 exd5 Ne7 Qh4 h6 Ne4 Ng6 Nxf6+ gxf6 Qg4 Kg7 h4 Rh8 h5 Qe7 hxg6 fxg6 Qxg6+ Kf8 Rf2 Qc5 Rxf6+ Ke7 Rf7+ Kd8 Qf6+ Kc8 Bf5+ Kb8 Qxh8+,-0.0029842795
-0.017046938,-0.013356865,correct_chess,d4 c6 c4 d5 Nc3 dxc4 Nf3 Nf6 Bg5 Bg4 e3 e6 Bxc4 Be7 Qc2 h6 Bh4 Nbd7 O-O-O Nb6 Bd3 a5 a3 O-O h3 Bh5 g4 Bg6 Bxg6 fxg6 Qxg6 Nfd5 Bxe7 Qxe7 Ne4 Rxf3 h4 Qf7 Qh5 Nc4 Qxf7+ Rxf7 g5 h5 g6 Rff8 Nc5 b6 Nxe6 Rxf2 Rd2 Nxd2 Ng5 Nb3+ Kb1 Nd2+ Ka1 Nb3+ Ka2 a4 e4 Nc3#,-0.03419285
0.0771948,0.0033964743,correct_chess,e4 c5 Nf3 d6 d4 Na6 Bxa6 bxa6 dxc5 Bb7 cxd6 exd6 Nc3 Nf6 e5 Ng4 exd6 Bxd6 h3 Qe7+ Be3 Nxe3 fxe3 Qxe3+ Ne2 Bg3+ Kf1 Qf2#,0.0021923822
-0.034169856,-0.0048572016,correct_chess,d4 e6 Nf3 Be7 c4 c6 Nc3 d5 cxd5 cxd5 e3 Nc6 Bb5 Bd7 Qa4 Qb6 Bd2 a6 O-O Nf6 Bxc6 Bxc6 Qc2 Qc7 Ne5 Bd6 f4 Bb5 Rfc1 Rc8 Qb3 Bc4 Nxc4 dxc4 Qa4+ Nd7 Ne4 Be7 b3 O-O Rxc4 Qb8 Rxc8 Rxc8 b4 Nb6 Qd1 Nc4 Bc1 Bxb4 Nd2 Ba3 Nxc4 Bxc1 Rxc1 b5 Ne5 Rxc1 Qxc1 f6 Nd7 Qd6 Qc8+ Kf7 Nc5 Kg6 Qxe6 Qc7 f5+ Kg5 Qxa6 g6 fxg6 hxg6 Ne6+,-0.027911082
0.0865215,0.0017166084,correct_chess,e4 c5 d4 d6 dxc5 dxc5 Qxd8+ Kxd8 Be3 e5 Nc3 Nf6 O-O-O+ Ke8 f4 Nc6 fxe5 Nxe5 Nb5 a6 Nc7+ Ke7 Bxc5#,0.011364354
-0.01890959,-0.005495879,correct_chess,e4 c5 Nf3 e6 Be2 d5 d3 Nf6 e5 Nfd7 d4 Be7 c3 O-O O-O Nc6 h3 f6 exf6 Nxf6 dxc5 Bxc5 Bg5 h6 Bh4 Be7 Bg3 Bd6 Bxd6 Qxd6 Na3 a6 Nc2 e5 Nd2 e4 Nc4 Qf4 N2e3 Qg5 Nd6 Bxh3 Kh2 Be6 c4 d4 Nd5 Nxd5 cxd5 Bxd5 Nxb7 d3 Bg4 Ne5 Bh3 Bxb7 Qb3+ Kh8 Qxb7 Qh4 g3 Ng4+ Kg2 Qg5 Bxg4 Qxg4,-0.010341587
0.11711428,0.04296086,correct_chess,e4 d5 e5 c5 g3 Nc6 Qe2 Nh6 d4 Bg4 f3 Nxd4 Qd3 Bf5 Qe3 Nxc2+,-0.015334877
0.037762213,-0.021015896,correct_chess,d4 b6 e4 Bb7 f4 a6 c4 b5 cxb5 axb5 d5 Ba6 e5 b4 f5 c6 a3 Bxf1 axb4 Rxa1 dxc6 Rxb1 Qd5 Rxc1+ Kf2 Ba6 Nf3 dxc6 Qc5 Rxc5 Nh4 Qd2+ Kf3 Qd3+ Kf2 Rc2+ Kg1 Qd1#,0.021899981
0.02450516,-0.026889294,correct_chess,e4 e5 Nf3 Nc6 Bc4 Nf6 d3 Be7 Nc3 d6 h3 Be6 Bxe6 fxe6 d4 exd4 Nxd4 O-O Nxe6 Qd7 Nxf8 Rxf8 O-O Ne5 f4 Nc4 b3 Nb6 e5 Ne8 Ba3 Qc6 Qf3 Qd7 Rad1 Qe6 Rfe1 Rf7 exd6 Qg6 dxe7 Qxc2 Rd8 h6 Rxe8+ Kh7 Rh8+ Kg6 e8=Q,-0.0016661027
