PCA1,PCA2,label,sentence,PCA3
-0.017347323,-0.004611579,incorrect_chess,a1 b7 exd6 Qxf1 Ng4 Qf6+ Bh2 Be6 b4 Qa8 Bf2 Nf2 Bxa4 Qg5 Bc3 Nf1 Ba8 Qd5 Na6 Qxh4 f6 Nf7 Bc2 Qxb3 Nd1 Nxa7 Nxg3 Qxd3+ Kd6 Qf6+ Ka1 O-O-O Qd2 d6 Qxc4 Qh6 Qxd2 Bxb4 Rac6 Ne8 Rb4 Bd6 Rhc2 f5 Ba7 Na4 d8 Kf1 d2 c3 Bf4 e5 Bxc4 exb4 Bh3 Ba8 Rg7 Rhd5 Rbb3,-0.0058150636
0.02507012,-0.007214056,incorrect_chess,g4 a6 Be4 Nb1 b3 Bd7 Bg1 Bxc7+ Kxg5 Nxf8+ dxa7 Qxf8 Nc4 Qc7 Qh3 Nf4 Rb3 O-O Ka6 Nf6 Qxf8 Qxb1 Nxh3 Nxd5 Bxh8+ Kd8 Bc5 Rxg6+ Bxb6 Nxg4 Nh1 Ng5 Nb6 e4 Nf3 d5 Nb6#,0.026802788
-0.033294357,-0.0027098411,incorrect_chess,e6 e8 h4 h7 Ng6 Nh5 f2 exc2 Nxa6 Bg1 Nxc5 bxe6 Be4 Bd8 Bxf3 fxg4 g5 Na3 Nf3 O-O O-O e5 g4 Ne3 b2 Be6 d6 Bxf3 Rxh3 Nb4 bxc5 a2 Rb3 e5 fxf8 hxa3 Na2 Nd3 Qc6 Qb1 Rd4 Ne8 Nxb6 Rxg4 Rxc4 exf8 Qxd4 Qxg4 Qd8 Qh4 b1 Rg7 Qxa6+ Ka4 cxh3 cxc6 Ra7 Rb7 Qb5+ Kd1 Rxa7 Qc1+ Ka3 Rg8 Qg8+ Kc1 Rh4+ Kc7 g2 Qh4 Qc5#,0.0011760818
0.04407771,-0.010066268,incorrect_chess,h6 d6 Na8 Ne5 Ba1 Bd2 f8 exb4 Nxh8 e7 Ne3 Nd3 Bd6 Nxb1 Qxh3 d8 Bf3 O-O O-O-O Bd4 Rhe8 Ra5 Nd4 Nxd5 Qxe6 Bxd4 Qxd1+ Kc5 a1 Rb3 Qc1 Bxh5 Bf4 Kf1 g4 Bxc5 Qd5#,0.00090924103
0.0641463,-0.0013997093,incorrect_chess,g7 h7 exg4 Qxb1 Nf8 Qc4+ Qb6 Na1 Nc6 h8 a5 g4 Qxa6 Bxg8 Bf4 Nbg2 O-O Bc8 Bh8 Re1 Na4 Nh1 Bh7 c5 Nbh1 d4 Rag5 e5 Ng4 Nh4 h4 b4 Nb4,0.00037474986
-0.058316723,0.0038153557,incorrect_chess,h6 f5 g8 dxb6 c2 a6 Bxb6 Ba7 Nf2 Nd4 Nba8 O-O O-O b2 Be2 Nbh3 e3 Ne3 Ba4 c7 g1 d5 Ka3 Nbg8 Qa4 g4 h1 c4 Nf7 Ba7 Naa6 Bxd5 Nxe5 Qf4 Bb1 Qc4 Rae3 Nd7 Ba4 Bxd3 Qxg1 Nf2 Rf4 g6 dxb6 Rfb4 b7 Qd3 Nea6 Ne3 Rf4 Nxb6 Rxd5 Nxe4 Qf6 Na5 Qa4 Na3 a2 gxc6 exb3 Rag7 c1 c3 a8 Ne5 Nxd8 Kc8 N1f6 Re7 Nxd8 fxg5 Nh2 Rda8 f2 Rgd1 fxe8=Q Rxg5 Qg5 Nh4 Nxa6 Rf2 Qf6 b1 Qa8+ Kh6 Nd6+ Rxc2 Qxc4 Ne7 Qg5+ Kd1 d6,-0.038826805
-0.019992903,-0.0123082055,incorrect_chess,h5 h3 Ne3 Qa5 b4 h5 f7 Bg7 Na8 e6 Bb7 Bh8 Qg5 Nh1 Qa1 Ba3 O-O-O Ng8 Bd4 Qh1 Bxg2 Kxg3 Qa2 Qd1+ Kg4 Ka5 f5 Ng2 c6 e6 Be1 Rb2 Nh1 h8 dxb2 Bxg4 Qh8 Nfg3 g8 g3 hxg1 Qg6 d5 hxf3 Qd2+ Nc5 Nh7 Qe6 Nxa3 Nf4 Nxe6+ Kh4 Re5+ Ne6 Rxd6+ Kd5 Rxf7+ Rxc7 Qf2+ Kh2 Nb8 Bd6 Qxc4,0.0009504496
-0.04619563,0.004184395,incorrect_chess,g2 d2 d6 h4 a2 g5 Bf4 a3 Bg3 e6 g6 Ne3 Ne6 b8 O-O Be7 Nbh1 a8 Nh7 Be3 Qh3 h8 Qg5+ a2 Nxb4 Nh3 Qh8 Rg4 Ne5 Qe7 Nda5 O-O-O Rd2 Rh1 Ne1 Rdd4 Re7 Nc7 Bxg3 fxf5 Qxf3+ Qxa8 Nxg7 Bxh8 Nxc4 Bxa5 Be1 Bg5 b8 a4 Rbc6 f4 Kd3 hxd8 hxg5 Kh2 Rg7 Bg6 Rc6 Ba4 Rxe1 Bh4+ Rxh6 exh6+ Kxe3 c6 axe5 cxb5 f6 dxd1+ Kxa3 h8 Kh2 Na3 Rg1 Nh7 f3 Na5 Rf4+ Kb8 c7 Rg8 Rxg8 Nxc2 Be4,-0.0043701646
0.027811088,-0.009421167,incorrect_chess,b4 e3 e2 Bc5 c1 e6 Ne4 h6 e4 Nc5 Ng8 O-O Bf3 c4 b4 Nh6 Nc6 Be5 Nh8 Bc8 Nxh7 Qxh2 O-O Nb1 Nb6 Rd1 h8 Ng3 Qf2 Bxf6 h1 Bxd2 d5 exa3 exh4 Bxd1 fxh3 Bxe6 gxh6+ Kf7 Qc8 Nxh5,0.014837417
-0.07121137,0.017331516,incorrect_chess,d8 Nb7 Nc4 h2 d1 d3 Nb8 Na8 Bf7 f7 O-O Bg1 h8 Bg6 Bf3 O-O Rh4 a1 c4 e6 Nf6 cxh5 exc5 e2 cxc5 Nxa3 Ngxa3 Nxc2 Bxd7 Nxb7 Qxd2 Qxd2 Bxd1 Bxc6 Rb8 Bg1 Rb2 Bh1 b7 Bh2 Rd4 Be5 Ra8 Bh8 Bd2 Rad1 Bd1 Rg3 f3 c6 Kh2 Be3 Bxh1 Kxf4 c5 Rc6 axf7 Rxa5 Rxd4 axf2 Rh4 Rd6 c5 a7 Bc7 Bf6+ Ka4 Rf2 Bxd5 Bb2 Rh6 Bg6 Bc4 Bd2 Bxb4 Rxc7 Rh1 Rf8 e7 Re3 Kc5 Kh4 Kd1 Ka6 Kg7 Kh1 Rd4+ Kh7 Rf2 Kc4 Kh1 a5 h2 f5 Rg8 Kh1 Kb1,-0.002592915
-0.00012528866,-0.011186729,incorrect_chess,b4 a2 h5 c3 c6 c4 e3 Nc3 f8 Nbh2 Ne1 cxc2 cxb3 Nf2 b1 Nfd1 Nh4 Bh6 Bh1 Nb5 O-O Ng6 g5 Nxe2 Qxb7 Bh3 f2 exc1 gxf7 Nb2 Nxd8 e5 a5 c6 fxf1 Qh8 exf8=Q+ Kxf1 Bb5+ Ke4 Nb2+ Kb6 Na1 Ba7 Bc3 Kd7 Nfh2 e8 Bh7 Qf4 Nd3 Bb6 e5 Rg7 Nf5+,0.0016392017
-0.013083509,-0.005679199,incorrect_chess,c3 g3 g7 f8 b8 f8 c7 cxh8 cxg6 Be2 Qg8 Qe3+ Be4 Qa2 Nc7 e7 Nf5 Qe1 Ng1 Qxg2+ Nf1 g4 Bh3 Qa1 Nxe4 dxe8 O-O exh1 Nxf8 Na8 Bxh3 Nf2 Ne4+ Kd7 Qd2 Kxa8 Qxh3+ Kg1 Rfc6 axc3 Rxc7 Nf7 Rc1 Rd1 Be3+ Kh5 Qxh1+ Kc3 Bxg5 Nf4 Qe7+ Ke3 g7+ Kg3 Qxc8 Nf5 Bb4 Nd5 Qf6#,0.026285306
-0.05005128,0.0035845628,incorrect_chess,b7 d8 a7 cxb1 Qxd5 Na4 Qg7 d8 h2 Bf5 Na1 e4 Bg8 Na3 Nd1 Qa1 Qe7 O-O d6 Bd1 Be2 Bxb3 Qxb6 Qxa7 O-O Qa5 Ne4 Nxb8 Raf8 Qe6 Qxa3 Rac4 Ng2 Nxd1 exd3 Qxd8 Qxg8 Rxd4 Bxb7 Rh5 Bxd5 Bxd6 Rbf7 Be3 Bh4 Rh5 g5 Rce7 Ba3 Ra8 Rf5 Rxb1 Rxa1 Raf5 Rc8+ Ke3 Ba5+ Kg1 Bg4 g6 Re4 Kg8 Rd7 e3 Rxc2 Rxe7 a3 Kf8 Kb5 e1 Bd8+ Ke5 Rc8 Rxb5 Bxb7 Ka1 d2 Be4 Be7 a8 d4+,-0.031174826
-0.053946406,0.016697664,incorrect_chess,f7 h4 Nd8 Na4 Ba7 Na3 d3 a6 O-O Bd5 e1 h6 Nd8 Nh7 Nc4 Nxf7 exe5 a4 a2 cxh3 Bxh4 Be7 Bxg7 Ra1 Bh7 O-O b5 Nd6 e7 exe8 cxe7 Bh4 Be8 a4 Nc3 Nxe6 fxh7 Qf6 Qc6 e6 Nf6 Bf5 f4 Bxh3 hxh3 Qa3 Qxe7+ Kg1 Qh2 Qg7 Qg2 Rbh2 Qxh6 Bxf6 Rd7 Bg3 b1 Bf3 Rf3 Rb3 Ba2 Rfd8 f6 Rd2 e6 Bb8 Rc5 Bb7 exa8 Bxc7+ Ka4 Rxh7+ Bxe8 Bxe8 b7 Re4 Re7 Bb6 Re2+ Ka7 Re6 Ba8 Kd2 Bxf1 Bc4+ h4 Bxc4 f7 Kc3 Ke1 h6 a2 c3 hxc2 Kxc1 Ka8 Rg6 Bf3,0.010988078
-0.06769646,0.016093176,incorrect_chess,d4 g7 c4 Qf2 dxa2 Qxb7 Qa7 Nc1 Nd8 Qxc3 Qxg7+ Nxb4 Nbh1 Nxf8 Bxc4 c4 Bd7 Rc4 Nd2 Bf2 Bxe3 Rxc6 O-O-O b7 Rh5+ Kg5 Be1 Bh5 Bb7 Bxa3 Nxc7 a1 Nh3 Na7 Nxe2 dxg5 Re8 Rg1 Rxa2+ Ka6 Rxc6 Rg8 Rb8 Rc2 h4 Rdc6 Rg8 Rxh6+ Kxd3 Rxh2 Rxc2 Rxc2 Rxd1 Rxh5 Rf8 b3 Rxc3 a4 Ra6 e2 Ra3+ Kd7 Rxe6 Rg5+ Kf2 d5 h7 f2 Rh8 b3 c7 Kb2 c1 Kf6 c5 Kc1 c8=Q h3 Qf7 Kd2 Qf5+ Kf2 Qxc4 Kc1 Qxb3 Kg4 Qf8+ Kc4 Rf4+ Kb1 Qe8#,0.005431387
0.02250319,-0.027731253,incorrect_chess,d2 f4 c3 Bb4 e8 d8 Bf5 c7 exf8 gxf2 Ne2 Qf4 Bh6 Qg1 O-O b3 Bh7 Ng3 Bxc2 Nd8 Bb3 O-O Nd4 Qc6 Nf7 Qb3 Bc5 Nf3 Bc3 Rc7 Ba6 Rf1 Bxf3 Rxb6 g6 Nb5 Nd2 Qb4 Nxh5 dxa4 Bd2 Nh4 f5 Bd6 a4 d8 Bxd7 Rf3,-0.001221961
-0.05747198,0.008912864,incorrect_chess,a6 e5 Be4 c6 Nc7 g1 exf6 cxc4 Be6 Nd5 Be6 Bc7 O-O c1 Rc2 Nf1 a2 O-O dxa8 dxh3 Nc2 Qe3 d6 e8 Bxb5 bxc3 Be1 Bc2 Bxb3 Bxh6 Nb8 Bxh4 N1d1 Rd4 Rh6 Qe6 Rxe2 Qxe3 Nxf4 Rxf8+ Rxa1 Be3 Na4 Bxa3 Rd5 Bxe1 Rxd6 Bb8 Na8 f1 Ne2+ Kd6 Nxh5 cxh4 Kg6 d2 Rd7 c2 Re2 Rc3 Kb5 f7 Kb3 Rf7+ Kxb4 Rf6 Kb6 Rc1 a8 a3 h1 Kb2 Rh2 Re8 Rxb2 Rxg4 Rb5 d7 hxe5+ Kxa3 Rf6 d1 d1+ Kxg2 Rxf4 Kxg5,-0.005453893
-0.0026888843,-0.007766111,incorrect_chess,f1 c6 Nd6 e7 a1 Nc2 a1 cxd5 Nxh3 b8 Nxh4 bxf5 Nc8 Nf3 Bc7 Rh6 Re2 Nxg7 Nxg5 h1 Bxb7 cxh1 Nc8 Bg1 O-O Qg1 e3 d8 Ng1 Qa8 Kc8 d8 fxd5 fxh4 Kh2 Bc6+ d6 d1 cxe7 Qxf2 Qxg4 Bf5 Qf4 Rd2 Qxf3+ Kb8 Re4+ Kd4 Qb5#,0.017210456
0.12862454,0.056962725,incorrect_chess,c2 a6 h4 d8 Nh5 Nd4 c6 h7 Ne8 c3 exf8 Nxf4 Qb1 Qd4,-0.018242458
-0.0477306,0.011129505,incorrect_chess,b5 f3 c8 d5 Bg6 Qa4 e5 Nb4 Bf4 Na3 Qe4 Ba3 h4 O-O Nd3 Bg6 Qe3 Bxa3 Kxa3 Bxd6 Bxh7 e3 Bh8 Raa1 Bxf4 dxd1 dxb2 Qxf6+ Kxc5 Nb3 Qxd1 Nh7+ Kb1 Nxf8 Bh4 a5+ Kg2 Nb4 Bxh8 Kxf8 Rc1 Nf5+ Ka2 Kb5 Qxh3 e4 Qxg4 Ne8 Bxb8 f3 Rf8 b5 Qd8 g4 Rb3+ Ka3 Rg1+ Kh2 Rh7+ Kg8 Bc6 f3 Bb2 g3 Re7+ Ka6 Qc8 exg8+ Kxa4 Ke6 Qc6 fxd1+ Kxg3 Kb3 Rb4+ Kb8 Ra5#,0.005148928
-0.048188716,-0.006776651,incorrect_chess,g6 d2 g6 h4 Nh2 Bb6 d5 g1 b7 Bf4 Nd3 Bxf6 exh2 Qd6 Bh2 Qxa8 Qxe4 Bxh2 O-O Bxd5 bxa6 Nh4 Bd3 b1 Bc3 b2 Rad3 Nbh5 Ba3 Ng2 f6 Nec1 d3 Ng4 Bd6 O-O-O Bc6 Rhc2 Bxd2 c2 Bd6 Rdc8 f6 g7 Rbe8 Kd3 Rg8 c5 Rfg3 Nh7 R3h7 Rg7 Bc6 Nf2 Kh1 Ne4 Rh1 Ne3 Ba5 Nxa2 Bb7 Rxc2 Bxc7 Rf2 Bxc6 Rxc5 Reh2 Rd1 Rxh7 b4 Rg7+ Ke3 Rf2+ Kh3 R1h3+ Kg6 Bg8#,-0.012474708
-0.0026633616,-0.0048600608,incorrect_chess,f8 b7 Ne6 Nc4 a2 Bb7 Nf5 Bc8 Nxh6 hxf7 Bh1 h6 Qa8 Bh2 Ng4 a8 d4 d6 Bd1 Nf1 c8 dxh7 Nxd3 h1 Nxf1+ gxd1 Qxg4 Qg6 Bc7 Nf3 Bf4+ Ne4 e3 h7 dxh2 e8 Bxh6 axb5 Qxe4 Rg8 Qb1 Kh1 Bb7 Kb2 O-O-O Rb1 f8 Rxa2,0.015569589
0.106410824,0.029223435,incorrect_chess,d6 f3 Ne2 Nf7 Be8 Bf8 f8 Bxg8 c6 Bh8 O-O d6 d2 Bg2 Bb7 exc6 cxg4 Bc2 Nc4,-0.0011361339
-0.095439024,0.046501514,incorrect_chess,f1 a6 Na7 a3 exb1 cxf8 a3 Nd1 Nb4 g2 Be4 Bf4 O-O Ng4 Bb6 O-O Qd7 Bg2 Rfa6 Qc3 Bh7 Qd5 Be2 g6 Bb1 e3 Ba6 Qa8 Nc2 Qb6 Bf8 gxd3 Qxe5 Nh2 Nxg2 dxg5 Rxh7 a3 Rxa7 Kg2 Nxb1 Rxa2 Raf8 Bh8 Qc6 Ra4 R1g5 Qf1 e5 Bxf5 Bxf3 Rc1 d4 Nc1 b8 Ng2+ Ka6 Rf3 g6 Re6 Ke2 Nc8 b7 Nxc1 dxc2 Bd5 c5 Qg6 Qg8 Bf2 Qf7 Qg6 c7 Qxa7+ Ke6 Qe4+ Kd6 Qe8+ Kf5 Qxg1 Qxd1+ Rg7 Qd4 Qxc5+ Kb2 Qe1+ Ke3 b7 e8=Q d7+ Kd6 Ba5+ g1 axa8+ Kxb3 Rxh1 Qxa7+ Ke4 Qc2+ Kf5 Qxe3+ Ke1 c7 Qf1 Qd4+ Kb7 Qxh2 Qxe6 e2 Qc5+ Kd2 Qb8+ Qf7 Qd6 d6 d6 Qg6+ Kg5 Qd2+ Kd5 Kf6 Qh3+ Ke4 Qg3+ Ke4 Qg6+ Kg2 Qg8+ Ke1 Qb6+ Kf5 Qf8+ Kg8 Qc7+ Qf3+ Qxe4+ Kxb7 b8 f7 g6 c5 h8 a8=Q h1=B Qxg5 Kh4 d1 Kf3 Qe3+ Kb2 Qe6 Kg7 Qd6 Kb3 Qh4 Kd1 f3 Kb1 c8 Kb6 f8 Kh1 Qh8 Kb8 c8=Q Kh8 Qa4 Kc8 Qcd1+ Kc5 Qdd2#,0.02914269
-0.07911979,0.015422672,incorrect_chess,g4 e3 a3 g3 Bf4 f8 g5 Nf6 Bb3 Bxf3 Nxb5 Nxb1 e4 Nd6 a5 exg5 Bxd1 Qe1+ Qb2 Qxe7+ Kxf7 Ng8 Bf6 Nd6 Rf4 Nce7+ Bxg8 Nxc8+ Kc6+ Nd4 Nf5 Kb7 Nf4 Na3 Rb2 h3 g7 Na3 Nxc3 fxe2 Nh8 Bc1 Rc7 Rhb2 h6 e8 Na3 a8 fxf3 Bxh3 Nxe2 Re8 Nb7 Rd3 Ng5 Re3 Ka8 Rxe7+ Kd1 Rxc1 Kc4 Re1+ Nf3 f2 Kc6 Rxe2+ Kb6 Rxb6+ Kxe4 Bxb4 Ra2 b6 f1 c2 b1 Be1 Re8 e1 Kd7 Rd6 Kf5 Rxc3 e3 cxb2 Kc6 Rd2+ Kd8 Ra3+ Kb7 h7+ Kb1 Rf5+ Kc1 g3 Rc1 c3 Rg6 c8 Rc8 Rg2 Ra4 Ra8+ Kd4 c7 Rxe4 Rxe4,-0.010191799
0.00027355168,-0.016965626,incorrect_chess,h3 Nf5 Ne3 Nxb5 Ng2 Nxf1 dxa1 f1 Ba2 Bc4 a7 O-O Bd5 a8 Bb2 c1 c3 Nd2 Qc4 b4 Ba5 d1 Ne8 b6 Bxa3 Qxc2 O-O-O Bg6 Bd6 Raa4 Qb5 Qxd6 Bxc8 fxf3 Ng4 Qg6+ Kg6 Nf3 Nxa3 Qxa6 a7 f6 fxf4 dxh2+ Kg1 Qe4 Qb2 Qf6 Rde4 g2 Qxh6 Rg1 Qg5 Qf7,0.005383637
-0.04997896,0.004887804,incorrect_chess,Ng8 f6 f6 g5 b6 Bb8 a2 Ne3 Nd7 h5 Bf7 Ngh7 Qb4 Qe2 Nf7 Qb8+ Nb1 b2 Bh1 h7 Nb3 Qg3 Nxe2 Qxg6 O-O-O e6 g3 Nxa6 Nxb3 Bxg8 Qh5+ Bb4 Qb6 O-O Bc5 Rfa8 Bxf6 Qxb7 Qxe6 Rxa3 f1 bxa2 Bxh5 Bxf1 bxa1 Rag1 Ka4 a7 a2 e6 a5 Rf7 Rb7 Rdd7 Rxe7 Rxa8 Re5 Kb5 Kg7 Kf5 Ra3 Ka2 Kg7 Kd2 d6 d6 exa2+ Kxd2 f1 d5 c6+ hxc1 hxc2+ Kf3 Kb2 Rc3 Ra6 a5 Ra8 Re7+ Rh5 Rxa7#,-0.00862538
-0.021006055,-0.0072016977,incorrect_chess,d4 Nh7 d5 b4 Bg5 Bf7 Bd6 e5 Ne6 Bxf2 cxf2 Bh5 c6 Bxg5+ Kxb3 dxh8 dxf4 Nxc8 Nd6 Nxe3+ Kb3 Ng1+ Kc7 Nc4+ Qxf4 Qb1 Qb1+ b7 Qg1 O-O-O Raf2 Qg2+ Rc7 Qxa5+ Kf1 Qh2+ Kc6 e5 b8 Qc6+ Kd7 Qd8+ Ka6 Qd8+ Kf4 Qd6+ Ka8 Qc3+ Kd8 Rh7+ Ka5 Qd2 Qb5 Qd3#,0.020824175
-0.076052405,0.030622687,incorrect_chess,d2 c2 b3 c3 Bf4 Nd3 b7 Nf3 Bg4 Bh7 Ng8 Bd2 Ng6 O-O e1 dxe2 bxa7 c8 Na2 Bd8 Nf3 Be3 Ne4 b4 Ne8 h3 Nd5 Kc1 Bg4 Bh8 Bxd7 h6 Bxd4 Qxh8 Nxb2 Qa6 Nxe7 Qxh7 Rc3 Nf4 Rxd7 Bxc1 Ne3 Nch3 Ng5 Nh4+ Kh2 Nf8+ Ka1 Nxc8 Bxg6 Ndxf6 Bd4 Bh3 Nf1 Bxh7 Nxf5+ Kh8 Bf1 Nxb3+ Kxf3 Nhb4+ Kf6 Kg4 Kh8 a7 Kd3 Nb7+ Kb4 Ng5 Kxc4 Nxa3 Kxa8 Kxf7 a7 Ka3 a1 Na4 Kd6 Ne5+ Kc4 Nd1 Ke6 Ka4 a8 Nxg8 e6 Na3 g2 Na4 g3 d4 a7 a4 g3 gxg7 gxb6 b6 e4 a1=Q+ Ke1 Qd5+ Kh2 Qa4+ Kxb7 Na3 h8=Q Kxf8 Qf7 h5 Qxe3+ Ka6 Qe5 b6 f2 Ka6 h1 Kh7 Qa2 g3 Qxa3 Kf5 c2 Kf8 Qc6 Kc7 f7 Kh5 e8=Q+ Kb8 Q4e1 Kh1 Q8e5+ Kf5 Qf5#,0.024705987
0.033360835,-0.009786285,incorrect_chess,g2 g4 Nh3 Ne2 Bh5 Nc2 e5 a5 dxg5 Nxh4 Bc7 Bh5 f8 Bxe5 Bxe6+ bxd4 Kf6 Bb2 Nb6 Nxf3 Qh3 Nxf2 Nxb6 Qh7 Qb3 Qf5+ Bxf6 O-O Qxc2 Raa7 Nd6 Be6 Rf2 Rh8 Rxc3 Bxa1 Nf2+ Kh3 Qxh3 Rd6,-0.0040968675
-0.016902894,-0.0060630688,incorrect_chess,a6 a6 b3 Ng2 Ng3 g1 Na4 Bb4 d5 Be6 g2 a8 Be4 Ne1 h8 Qg6 Bf6 Qh2 Rc8 Ne6 Nxd3 exe4 Nh8 Nxh3 exd6 Be2 Ba3 d8 Be3+ a8 Bb3 O-O-O Qg8 Rhe2 O-O Bc3 Qh6 b5 g1 Bb7 b8 Qh4 Qb7 Bb8 b8 h1 a4 b4 axf5 axe3 Rh8 Kg2 Rc5 Ra2 Qc5 Bxg6 Rxf6 Rxh2 Qxb3 Bxd6 Rb8 Bxc8 Qf8#,0.01708764
-0.0014567593,-0.014324707,incorrect_chess,e3 c3 d6 Bb3 Bc2 dxg1 b6 b1 Bxa5 Be2 Qa6+ d7 Bxd4 g6 Qb1 bxa8 Bd6 Nf6 Bxf2 Rh5 Bf5 Re4 Bxf6 Qh5 Bc3 Nc3 Qc7 Rf3 Nf2 Ne7 O-O-O h7 Nxg8 Kxb5 Ng6 Qxg1 Qxa3 Rxb3 Nh7 Rxe2 Nxa3 Bf4 Nd5 h3 Nxh1 Ba2 Rhb4 Bxb4 Rh4 exh4 Qxb2#,0.011164675
-0.02289235,-0.010931308,incorrect_chess,b2 h5 Ng6 Nh7 Bd6 g4 f1 Bd3 c1 cxg6 cxc5 Qa5+ Nd8 Rg4 h5 Nf4 Bxd6+ Nxe8 Bg6 Nge2 Qh2 Qc6 Ne1 g4 Qa5 Bb6 Ndf3 O-O O-O Nf5 Rab2 Ng1 Nxe8 Rxe7 Nb1 Rxc8 Rxh8 d7 Nb1 Qh4 Nxe5 Rd7 Nxc6 Rxh3+ Bxh8 Qxb1 Bf4 Qe4 f3 Bf7 Ka6 Nb5 Qb5+ Kd2 h3 Ng1 a1 Qf2 Kg1 Qc2+ Bc1 Bf4,0.0024224673
-0.07816751,0.03136285,incorrect_chess,a2 d2 c8 e6 f3 e6 g3 Nb4 f2 Nbg3 Bg6 Bd5 Bxb6 Bxc6 Nd8 cxc3 cxa7 Nf7 Na7 Bc6 O-O O-O c8 Nc6 b1 Nxb3+ Qxe4 Bxe7 bxb2 Rd8 Bf6 Be2 Rf1 Be6 f4 g5 c4 d2 g3 exg4 Qxf3 Qd6 c7 Rg7 a6 gxh1 gxg6 Re7+ Ka6 Qb3+ Rc8 Qd6 Qa5 Qh6 Rg7 Qe1 Rhh8 Bc5 Rc4 b2 Rxe8+ hxa8 h2 Bf7+ Kb8 Ba1 b6 Rb8 Qb4 Rxa6 Qxf5 Qxh3+ Rc6 Qxg7+ Kb2 Qb2 Qa5 Qh2 Qg4+ Ka8 Qe5+ Qb4 Qd5 Bg7 Rc2 Qa5+ Kd8 Qf6+ Kd3 Qh4+ Kd6 Bg5+ Kd8 Qf2+ Rc5 Qe8+ Kh6 Qg8+ Kc8 Qg7+ Kd1 Qe4+ Kd4 Qb7+ Kf3 Qc4+ Kc5 Qe4+,0.019718107
0.027952036,-0.023848474,incorrect_chess,a8 b3 Nc7 f4 exe5 cxc7 d3 Ng5 Nh1 Bf5 Bb5 Nd6 Bg2 e6 Bf2 g4 Ba8 a3 O-O Bb5 Qg5 c5 Bd7 O-O Ne6 Nxe1 Rh4 Nxa5 cxf1 Bb6 Ne7 Qa2 Nxg2+ Qxc2 Nxc5 Nxb5 Rxd3 Qxh7 Rg6 d6 Qxb1 Bxb8,0.021377996
0.011137546,-0.008452483,incorrect_chess,b6 g4 a1 Ng1 Bf5 b5 Bg6 a5 d5 Ngg6 Bf3 c8 Bg8 b5 Qd2 g2 c5 Qd2 h8 Qh5+ Na1 a6 Bf8 Bg6 Bxe2 Bxh3 Qc6 Bf5 Na4 Ng5 Qd3 Nxf3 Re8 Nxb7 fxd8 Be7 Na5 bxb1 Ne7 Bxc3 bxf1 Bxc5 Rb3 Qxg8+ Kg3 Bh1 Rf4 Rd2,-0.0035758298
0.018490536,-0.020031251,incorrect_chess,e7 f2 Ng5 e7 Bf7 Bd7 O-O f7 h7 Nc1 c6 exc7 exg2 e8 Rb7 O-O Bg1 b3 Ba5 b8 Bd3 Nh5 d8 Nxd2 fxe6 h8 Qd5 Nf3 Qc3 Nf6 Rxa3 fxc7 hxh5 Bb8 Qe3 e8 gxb7 exc6 hxb1 g6+ Kd7 Rg8 Nf3,0.01261799
0.020040553,-0.011816623,incorrect_chess,b6 e1 d4 exg4 Qxa6 Ne5 Qc7 a5 Nh8 Nf6 Ne3 Bd6 h5 Bh6 Be8 O-O e5 g4 cxg4 Nxh1 Nxa7 Bxe2 Nxf4 Qxc2 Nxh1 Rab3 Nf4 Bd1 Bc6 Bxb1 Qc8 Qxc7 O-O-O Bf7 Bc8 Bxe8 Rxd3 Qxg4+ Rd3 Rxc1+ Qxa7 Qxb2+,0.013208069
0.090606615,0.0043501975,incorrect_chess,g1 e6 e5 h2 e6 Qe2 Nd3 e6 f4 dxf1 Nxe3 Qb2 e3 Bf5 Bh6 Qd6 Nb1 Ng6 Nb8 O-O-O Nxb5 fxd7 Bxb3+,0.0073182886
0.03513592,-0.008774457,incorrect_chess,f5 b3 c2 a4 b2 cxa3 cxh1 Be3 Nb8 e6 Na4 Nb2 Bg4 d6 O-O e3 Bd1 Bb6 Be2 d5 a1 c8 Na3 f7 Ba6+ Ne8 Qg2 Be4 Bh1 Bxf1 Qxf7 O-O g2 Nb2 axg2 Nxa4 fxf1 Nc6 bxd7 Na2 h6 Qh7 Qxg8,0.003950791
-0.01925837,-0.007664379,incorrect_chess,e2 Nf7 e4 g7 b7 Nch5 Nh8 Ne5 Bb6 Ba4 a2 Bxf2+ bxb4 f4 Ba2 Nh2 f8 Bb6 Nc2 Bb2 O-O Qg7 Bd4 Na8 Bxg1 Nb4 c4 Bxg1 Bxh3 Bxf7 Bxf6 Bxf6 Bxg3 Qc4+ Bg5 Qxg4 Rg3 Nd2 Nf5 O-O-O Qf1 Nxb6 Nxc3 Rhh4 Kg3 Qf7 Qb6+ Kf1 Qxe8 Qxc4+ Ke8 Qxd6 Rc6 Rxd5 Qxg8 Rd4#,0.006703971
-0.06288354,0.0154230455,incorrect_chess,d1 c2 b4 exe7 Qxb2 Nc4 Qg7 Nf8 Na2 e3 Nb4 h1 Nxd5+ Qxc8 Bd7 Bf8 Bb7 Qe7 Rf7 O-O h1 Be4 Be8 Bxh8+ bxh2 Qc2 Bg6 g1 g7 e7 Bc5 Bc3 Nh5 Rab2 Bxd2 Bxg3 Nf6 e3 Na2 Qg5 Ne4 bxd7 Na4 Rf1 Nxg3 Rxe5 Ra2 Rxa8+ Qxa1 Bd8 Nc7 f3 Na4 Qc7+ Kh7 Qxc7 Qa5 Qa2+ Qg1 Qxf3+ Kxf2 a1 Re2 Bb6 Rxf8 Bc8 Rh6 d5 Rh8 Re3 Kg2 Ba7 Kh8 Bg6 g6 Rf4 g3 b2 Ke6 Ka3 Kg5 Kd7 fxb2 hxa6 d5 Rxe5 c2 c5 e7 e5 gxa7+ Kxc3 Kb2 Rh7+ Ke5 Kf1 Kd6 Rb6+ Kb6 Kd3,0.009739355
0.05803606,-0.013680166,incorrect_chess,d1 b7 Nd6 e7 Nb4 Ne5 b3 cxc4 Nxh5 a2 Bd2 Bc4 Be8 Nb8 Bg4 O-O Qc1 Nf5 Qe2 Nb8 O-O-O c5 e5 Nxh8 Qxg3 Be5 f6 Nc1 Nxb4 Bxf3 g6 b3 Rhc3 f8,0.0061667706
0.021005651,-0.010409793,incorrect_chess,b7 e2 a3 Be4 Bh4 b5 Nc2 h1 c7 g4 c2 d1 dxb7 Bxa4 f5 f8 Nf6 b1 b2 fxb3 Be3 Bxe7 fxb5 g8 Qg5 Bxg4 exe1 a1 Rd3 e3 Ra2 g7 gxg1 d1 hxc8 Rxh3 Rg4 Rd5+ Kc3 Qd2+ Kf6 Rg5+ Kd8 Qf1+ Ka8 Qb3#,-0.002854319
-0.018992472,-0.0021617298,incorrect_chess,e8 e1 Bg3 b7 d5 g5 d8 g4 d2 bxe1 d1 b4 exg4 cxa3 Bb1 a2 Bd5 b4 cxb6 exb3 Bxe1 Qxa2 Qg6+ Ke5 Qxe1+ Kf3 Qa4+ Kd8 Qd2+ Kd1 Bg7+ Ke7 Qe7+ Ke8 Bxc5 Ne2 Bxf8 Bg4 Qxg4+ Kd1 Qb2+ Kd8 Bxa1 Bxh5 d4+ Ke8 Qd1+ Kh5 Qxh3 b2 Qxh1 Nb8 Qxa3 Nf8 Qe1+ Kh5 f8+ Kh3 a4+ Ka3 Kc7 Na2 Nb2#,0.023343533
0.054028176,-0.0034577372,incorrect_chess,a5 e8 Nc1 d4 Bh6 Nb5 Nc1 h7 a6 Ba4 dxf1 dxd7 Qxf2+ Bxd5 Nxf7 Nbc2 Nxe3 Rg6 Nxd1 Kxg7 O-O Nc8 Bh1 Bb4 Bf8 Ra1 d8 Bd8 Rae7+ Ke6 Bxg4,-0.0030801792
-0.072818585,0.0114556365,incorrect_chess,g1 b3 f3 g5 b8 e7 h2 e5 h3 axd6 h8 Qf1 Bf5 Nc4 Bxg7 Qa6 Nb6 Nga4 Bf8 c6 O-O h7 cxg1 Qxe3 Bxf7 Nxh5 Ne4 N8b1 Rh1 Qh1 Rh2 Nf8 b3 a7 Qa3 Nda5 Ng6 e1 dxa2 Qxb5 Qd7 Qxb4 exa6 Na8 Nxd8 dxd7 Bxf4 Bxh5 Nh8 Ba8 Rd3 Rxd2 Ra1+ Ka2 Rxe5 Bd2 Rd5 Ba1 Ng5 Bf5 Rxf3 Rg4+ Ke7 Bf8 Rcxf2 Be1 Rh8 d3 Ra5+ Ke4 Rxf4 Kc8 Rb1+ Ka7 Rf1+ Ka7 Rxe2 e1 Re5 Rh6 Rxa6 Ke8 Rb8 Kb2 Rbg4 Rc4 Nxc6 Kd2 Rg2+ Kc3 Rd6#,-0.018178863
-0.06826983,0.0147654535,incorrect_chess,a8 a2 c1 b2 exg8 Qxc1 Nf5 Qg7 f5 f2 Bh7 Nb3 Be7 g6 Qe7 Na4 O-O-O Bg3 b7 cxg4 Bxc6 Nxf2 Qxh2 Bg3 Bc2 Bxf3 Qxf5+ Rxc3 Rxb1+ Bxa5 Nxa1 a8 Nh5+ Kg4 Na1 a2 Ng4 Ra1 Ne4 Bd7 Nf8 d3 c1 g8 Ra1 Nb1 a6 b3 h3 h3 Nd2 Bxa8+ Kd1 Ng8 Ne6 Be7 Na7+ Kb6 Nxg3 Rb3 Nb2 Bd3 Rg5 Bd3 d1 d8 Nf5 Kg8 Ra2+ Kc1 b1 Bh2 Re5 Bxd8 Ka6 b7 c8 Nc1+ Kg2 Bb5 Ra7 Rd8 Nb6 Rc1 Rxg4 Rxg2+ Kf7 Rxe6+ Kh7 Rf8 Ke4 Rxc4 Nd3 Rxa7 Na8+ Ka5 Ne5 Ra2 Nf8+,-0.010562612
-0.03895656,-0.0080273505,incorrect_chess,a3 g5 Nb6 g1 Ba2 d7 exb5 exf4 a3 Na5 dxd2 Bxc3 O-O Bc5 h5 O-O Bc8 Ne8 d3 Bb4 Bxe2 Qxd6 Nbf8 Bd4 Nh3 Bg7 Bg4 Ne2 Nbh6 Nxg6 cxa8 Bb2 Bxe1 dxb8 Nf8 Ng5 Qd5 Nb1 Rab1 g2 Na4 Qe7 Ne1 Qg4 Qxa6 Ng2 g5 Nxf7+ Ke6 Nb3 a1 Qa7+ Kd3 Nf5+ Ka8 g3 Qe6 Qxg1 gxg1 Na1+ Kf6 Nd2 Rd1 f6 f4 Ne1 d4 Rab2 Nf8 Rxd8 Rxc7 Nxd2 Rc1 Ng2 Ra7 Nh3 Ra7 Nf8 Ra8 Nd8 Nc5 Nc3+,-0.020734994
0.022105807,-0.024458133,incorrect_chess,d3 d4 Nb7 Ng2 Bh4 Nc3 d1 g7 Bf5 Bf5 a2 Ba7 e5 Bc8 Bxc4 fxa1 Qe1 Qh5 Qxd7 O-O Qc1 Rae1 Qc1 g6 Nba1 f3 Bxg1 Rxb4 O-O h4 h1 Qc4 Rfg2 Qh6 g8 Bb7 Qc2 Bd6 Rf1 Rbd1 Ng1 Qg2 g5 Qxb6,-0.006318414
0.02174545,-0.016530251,incorrect_chess,f6 g5 a8 a3 a5 Nh7 Nf6 Nc2 Bc7+ e5 Be1 Bf8 Bxh1 fxd7 Ng2 O-O O-O e4 dxg1 Bxh4 Bf8 Qa1 f3 Qxd4 Na8 Qe3 Nxf8 Qxh5 Ba4 Qf8 Ra3 Ng3 Ba4 Rd7 Bd2 Qc1 Qg7 b6 Rcf6 h6 Ne6 Rh8 c2 Bb1 Qa1 Nb7,0.005504699
0.070012175,-0.00829799,incorrect_chess,a5 c3 d7 cxb5 e2 dxc8 Nxc3 b2 Nd8 e3 Bg1 Ba6 Bh8 Ng7 Rd4 O-O O-O Nf2 g2 a3 f8 Bc1 Qf5 f2 Bxb1+ Rxh1 Nc1 g4 Bxb4,0.012266008
-0.03657612,0.0027010487,incorrect_chess,g7 g2 h3 Bh8 e8 a6 h7 e6 d6 exe7 exd5 h2 Qg1+ Qg3 h6 gxc3 Qxc6+ Bxd4 Bb5 Kc7 Bxb6 b2 dxd5 Bxh2 Bb6 Bxa6 Bf8 Bxh3 Ne3 Bxg5 Re5 Bb2 d1 Bd7 c8 Bxg2 Na8 Bxd5+ Ke4 Bxc4 Kh4 b5 Rxb3 Bg6 Re8 d6 cxf8 Bxa6+ Kb2 d6 Rb7 Ba3 Ra7 Nh5 Rf3 Rg2 Rc8 f3 Bf3 Nh4 Rc7 Ng5+ Kg2 Rb4 Rf6 Ne3 Rxc6 Ra3+ Kg8 Bb7+ Ke2 Rcb8 Kh5 Rc8,0.002566066
-0.018836873,-0.014889771,incorrect_chess,Nc5 c5 e8 Be1 h2 a2 Na4 Bd8 e5 a4 g5 Nd1 Bg2 exa6 exc7 d3 Bg1 cxf3 Bxe8 Bxa6 cxg3 e6 O-O Nc2 Ra1 O-O h4 Be5 Rd6 Bxc5 bxf3 Rf7 d5 Na1 Ba2 Nh2 Bc4 Qa3 Qb5 Rfa1 Nd8 Rxa7+ Rxf2 Rc7 Rxb1+ Qxd5 a1 c1 Ng8 Kd7 Bxc5 Nd7 Qh6+ Kh3 Bg8 b7 Bxb6 Kh5 Nc2+ hxa3 Be6 Nxg8 a6 Nd1 Ka6 Qc3 Kf8 b8+,-0.028423985
-0.062421873,0.011793226,incorrect_chess,d2 e6 Nh2 h3 d7 Bd5 Bb7 Na3 Nf3 O-O O-O h7 c8 c7 Be1 g5 Qb5 Qc8 Bxg5 Qxd5 Ng8 c4 Na5 b1 d7 b7 Ne1 h2 a7 gxg8 gxb3 e3 Ba5 Ke3 Kf2 Rh8 Ba8 Nh1 Ra4 f3 Rb2 cxa7 Qxd5 Nb2 Rae4 Nd2 Nfxg3 fxg6 Nf2 Bf1 Nf8 Rae3 e5 Rcb8 Qg5 Qd4 Bh4 Qxb3+ Qxd8 Rxh2 Rxb5 Rxf1 Rxf1 Kxf1 Be7 e6 Ka4 Rg2+ Kd3 Kd5 Nd5 d7 Nb6 Rxe2 exe7 Kxc3 Bxg4 Kf5 Kxg2 Bxb2 Kc5 Ba7 d6 Bc1 c5 Bh5 b5 Bf7+ Ka1 Bb5 Kxa2 Ke4 Kh1 f4 g4 g2 h8=Q e1=Q Qe2+ Kf7 Qxb8,-0.0033885401
-0.0040737544,-0.010293295,incorrect_chess,a1 f7 a2 c7 c4 c3 b6 Na1 e3 Ngh4 c4 cxa3 cxf5 Qa7 Nf7 Ng6 Be6 Bh3+ Nc2 Be7 Bb1 Rh6 Bxb2 fxh6 f6 Bxb5+ bxg8 Nc6 Rg1 Qg7 Rf1 Nd8 Qf5 O-O Nc5 a5 d1 Qg6 O-O g1 Nf1 Bxh2 Re4 g3 Rfe2 Qc6 Be8 Rxg8 Ng2 Ke1 Qa8 Rcf5 Qxd7+ Kc8 Qxh2+ Qxa8,0.0124086
0.073747404,0.006545763,incorrect_chess,e6 g2 Nb8 Ne2 Bc3 g7 d7 exa3 Nxe8 Be2 Ng6 Qc8 Ne8 Ngd3 Bd6 d6 Nf7 Nxa8 Bxa5 O-O Nxf1+ gxc8 Qa1 Qxh3 Ka6 Qxf5+ Kb4 Qc8 Qb7,0.008413293
-0.012264082,-0.0037465391,incorrect_chess,e6 g4 Nb6 Ne7 e4 a4 dxh1 dxh6 Bh4 Bh8 O-O O-O Nf3 Bf4 Bf5 Bxg1 fxh3 Nc8 Qa1 Qc5 Nh7 Qh2 Rg3 Be8 Na6 Bxc7 exg7 Nc6 Qb8 d1 Nh3 Na5 Nxc1+ gxb8 Qf5 Kd7 h4 Rg7 d4 Qg7 hxg7 fxg3 Qxg5+ Kh1 Rb3 Qd3 Rxc3+ Ka7 Rg8+ Kd4 Qe4+ Kd5 Bg5+ Kg8 Qxe3+,0.02247081
-0.030847922,-0.0048306775,incorrect_chess,g5 g2 h8 g6 Nc5 dxf4 Nc5 Nc5 Ba7 Bd4 c5 a3 Bxc6 Bg1 Qf7 a6 Bc4 Nbg8 O-O-O Ng2 Bg2 f8 c4 O-O e2 Bb1 f2 Ba5 Bxh2 fxb8 Qxh4 Nfb1 Bxg1 Qxe4 Nf7 Rxc2 a6 Qc8 Qf2 Nf3 Qxa1+ Rxe7 g8 a8 f6 Rfb3 Nh2 d1 Nxb3 Rxh3 Rg4 Nxg7 Nc3 Ng6+ Kh6 Nd4+ Ka4 Ne4+ Kd8 a8 h3 Na4#,-0.0010499244
0.070564315,-0.009761801,incorrect_chess,a8 d4 Nc5 d8 f8 Nh4 Bxe6 bxc2 dxc6 Bb8 cxe8 exb2 Nd4 Nb6 f6 Ne2 exd6 Bxa3 d7 Qh3+ Bb2 Nxc2 fxd4 Qxf1+ Ng1 Ba7+ Kf5 Qg8#,0.016872313
-0.037752282,0.00061606575,incorrect_chess,g8 h6 Nb2 Bb7 g1 a1 Nf6 c8 cxa6 cxe4 b5 Ne5 Be4 Bd5 Qf8 Qb2 Be4 c2 O-O Ng8 Bxf1 Bxg7 Qg7 Qd2 Nc8 Bb2 b8 Be8 Rfd6 Rb2 Qe4 Bg8 Nxd5 dxh5 Qc8+ Nf5 Nb8 Bd2 h2 O-O Rxc7 Qf2 Rxa5 Rxh8 e4 Nh4 Qg4 Ng7 Bb2 Bxg6 Nb4 Bf5 Nxh4 Bxa2 Rxb2 b4 Ng4 Rxe1 Qxf2 e7 Na2 Qa6 Qc2+ Kh2 Nb7 Kg4 Qxf2 Qd1 e3+ Kh6 Qxb2 d3 fxd2 hxh5 Ne3+,0.00017504876
0.08672086,0.0055545033,incorrect_chess,c4 a8 e2 h5 dxf3 dxb7 Qxe8+ Kxg8 Bh1 f1 Nh1 Na7 O-O-O+ Kc4 e6 Na7 fxa1 Nxh6 Nb3 e1 Nb6+ Kc1 Bxd4#,0.014953552
-0.021985002,0.0008968014,incorrect_chess,c3 f1 Nd1 f2 Bc3 f4 h4 Nb5 f1 Nfb8 e6 Ba7 a6 O-O O-O Ng3 g8 b1 exa7 Nxc5 dxf2 Bxb6 Bh7 e1 Be8 Bf8 Bd3 Bg7 Bxe1 Qxh1 Na3 h7 Nb2 c3 Nc3 c7 Nh7 Qd6 N2e4 Qg8 Ne3 Bxh7 Ke7 Be7 b7 g2 Nh5 Nxd8 cxh7 Bxe8 Nxd6 b5 Bf3 Nc4 Ba7 Bxe5 Qa4+ Kb8 Qxe5 Qa7 g4 Nb7+ Kc6 Qc3 Bxa8 Qxh5,0.017112242
0.12974575,0.06896897,incorrect_chess,a8 c1 f8 f8 c8 Nc4 Qa6 Ne5 a3 Bh1 c8 Nxc1 Qb4 Bd6 Qc5 Nxe4+,-0.030027993
0.045071844,-0.017668433,incorrect_chess,e3 e3 e2 Ba1 e4 e8 d3 f8 cxb2 axb1 c5 Bh4 g5 c6 a6 e5 b5 Bxd8 axe3 Rxf7 dxg3 Rxg1 Qa4 Rxd5+ Ke2 Bc8 Nf6 dxb1 Qc3 Rxd8 Ne2 Qg5+ Kb1 Qh4+ Kh6 Rh8+ Kc4 Qe3#,0.013887978
0.0134160165,-0.024007667,incorrect_chess,f8 h8 Nb5 Nc6 Bb1 Ng8 e3 Bb4 Nf7 d3 g1 Be3 Bxf7 fxf1 a7 exh5 Nxd4 O-O Nxe7 Qe6 Nxh6 Rxh4 O-O Nb5 f5 Nd5 c7 Nd8 e7 Nf4 Be6 Qd8 Qc1 Qc5 Rae1 Qf1 Rfe3 Ra1 exh2 Qh3 dxc2 Qxc2 Rf6 h4 Rxc3+ Kf1 Rc2+ Ke5 e8=Q,-0.009275606
-0.07087496,0.023051282,incorrect_chess,a4 f1 Ne8 a8 exa6 exf1 a1 Ng1 e1 Bg1 Bh6 O-O O-O Bf8 Bg4 Nba8 Re1 d1 Bf1 g5 Ne6 Qe4 Nxa5 Qxf8 Bxg6 gxe6 Qc4 e8 Nc7 Kg8 Na3 Rd3 Nb7 Bxb8 Qxa1 Rd6 b6 Rae7 Ke2 a1 Rd1 d6 h7 f6 Rah3 a6 h2 a6 dxf6 bxc3 Rd5 R8d8 Rgf8 Kd6 a2 Kf6 R5g6 Kh1 Qf1+ Rc1 Qb1 Rfc2 Rg1 Ke8 Bc3 Qh1 R5g7 Kd3 Qa8+ Rd1 Qd8 Kc3 Rb2 Qd6 Qf3 Qf4 Ba5 d4 Qe4 Kd6 g4 Rg6 Qa4+ Kh6 Qxd2 Rfg3 Qc1 Bd3 Qg8 Be6 Bg2 Bxa6 axe4 Qa6 Qd2 Rh5 Qxe1 d3 Rxa7+ Kc4 Rhd7 fxg1+ fxh7 Rxa8,0.006623365
-0.06452472,0.010394521,incorrect_chess,Nd2 c4 f7 Bh3 e3 e7 Nh1 b2 a6 Nh8 Bf1 O-O O-O b8 Qh6 b3 cxh3 exf7 g6 Na1 h1 Nb7 b3 Nb3 Bxg3 dxh7 Nf6 Nb2 Qd8 Bh1 Nxa2 Bxd7 Na8 c7 Ba4 Bxe2 Qh1 Bxd5 Rxb8 Qa7 b4 bxf7 Qh4 Qc4 Rb4 Rab6 Ba6 Rc3 g2 cxe1 Bxf3 Rxc4 e7 Re6 Rg7 Rdf8 Kd8 Rd5 Qxh5 Qxh7 Rxb8 R8h2 a6 Rh3 Rg7 Rxg4 d7 Rcb2 Ke1 Kh2 e5 Kg7 Kf1 Kc8 h5 f7 g6 e1 exc4+ Kxh6 Rxb5 Re1+ e6 Rbc5 Ke5 Rxc6 Rb4+,0.00018500247
-0.006452886,-0.010443151,incorrect_chess,f5 e7 c8 h8 dxb6 dxh4 Qxb7+ Kxh5 Nf4 Ne1 Ba5 Ba5 Bf3 Ng8 Rc1 Bg5 d6 Bf3 Rxd5+ Ka7 Bxf6+ Kxb2 Rxb5 Rb5 fxh2 Be2 Nb2 f7 Rxf7+ Nb6 Rd4 Rb4 Rxb1 f7 O-O f5 Nxe6+ hxd6 Bxc8+ Kf4 Bxf7 Rc5 Rb5+ Kb6 Rxg6 Kg3 Rf3+ Ka5 Rb5#,0.017285647
-0.04537065,-0.00022473301,incorrect_chess,f6 d7 Nd3 a6 Bc7 h8 Nc3 e4 g5 d2 Ba5 b5 a4 d3 Nf8 e5 c8 Bh7 Nee6 Na8 cxb5 cxf8 h2 Bd1 a2 Bb3 Nf3 Ne7 d7 Ng7 e8 Bh5 Nb5 Nxh5 Qxe1 Nxe3 e4 Nc3 Nc1 Bg5 Ra6 O-O Bxa8 Nxf5 Qe6 Ba4 Ba4 Ng5 Nxe2 exc6 Bxc8 Bc8+ Kh2 Rh8 Qe5 h2 Nh6 Rb7 Kg5 dxg2 Rxc4 Kd3 Re2 Ra6 Nxe1 Rxh4+ Qxe3 Qxd1+ Kxf1 Rg3+ Ka3 Bf8 Re5+ Kf6 Be2 b5 Rxd3+ Kg4 Rxc1 fxe1 Rxd4,-0.014400255
-0.050618246,0.008521268,incorrect_chess,b6 g7 h7 f1 Nc8 Nf3 Bc1 Bd1 Bxc8+ bxa8 O-O Qb4 c6 Bxc8 Qxa1 Qxd3 a4 Ne3 Bg7 Qb3 d5 c1 f7 Qa1 Qf6 d6 d1 a2 Qc4 Nd7 Bb4 Bh4 h1 Ne3 Be5 d7 Bxd6 exh7 Bxb4 Qxc3 Na8 d1 Rah5 Kf1 Qa6+ Kg1 Rxb8 Kxg5 Rc3+ Kh2 e5 Qxd3 Qxa8 fxf6 Bg7+ Ke8 g8 Rag7 Rf2 Rh5 Rb3+ Kc4 Rh2+ Ka5 Bxb6 h5 Be7 Rb7 Rxb5 Kd8 Rxg3 Re2 Rc5+ Kd3 bxd1 dxg3 Nh4 Rg5+ Kg2 Kf3 Na1+ Kb7 Nxg1 Kh1,-0.01016967
-0.079432316,0.030521557,incorrect_chess,f4 c6 h6 a6 Ne4 b7 Nf2 Nf1 Bc1 Bg2 Bh2 h6 Bh2 O-O d2 Nbd7 Bb8 dxc4 Bxd7 Na2 Bg6 Nbe5 O-O Nxb3 bxe6 Nb7 Qb7 a4 a5 fxh1 Bxf1 Nb5 Be1 Bg3 Bb7 Bxh8 Nxc4 Nb5 Ng3 Rd4 Bd3 Qa5 Bh3 Ng8 Na8 Rc4 Raa6 Be4 Nd7 Qh1 Ne8 Qb8 Nxh6 Rxf6 Rb5 Rg2 Re6 Qh2 Rh6 Qa1 e7 Red3 Qg8 d3 Rd6 Qc1 Bh3 Qa1 Bxa6 Rxd2 dxa7 Qg3 Qxc7 Rxf5 g4 Rd8 Ra6 Rxc2 fxc5 Nxb6 Rd8 Ne3 Ke7 Nh8+ Ke7 Nxa4 Kxa7 Kf8 Ka1 Kd4 Kf2 Kf4 b7+ Kb2 a7 f7 Kb6 f4 c1 d1 d1 a3 hxb1 hxh5 Kd2 d6 Kg3 g3 cxb3 axh6 Kc8 h6+ Kd3 Kxd4 Kf8 Kd7 Kxh4 g5 Kh3 b5 f8 c1=Q+ Kc5 Qh8+ Kb3 Qc2 a5 Qh1,0.013512317
0.013672692,-0.0056691244,incorrect_chess,f8 b6 Bd4 Na4 a7 Bh7 c6 O-O a8 d4 gxg4 exd8 Bf1 f1 Bxc1 Kxa3 Bxd2 Ne2 Bxd5 dxf6 Qc4 Qa7 e8 h1 Qg8 c5 Ra2 Kg6 h8 Qb4 Ng2 bxh4 bxh8 Bb4 d2 Qxh1 Qe7 Re7 a7 Qd6 g3 f8 Nc2 Bxd7 Nxg1 cxe3 Qxb4,0.010516735
-0.016411955,-0.018010719,incorrect_chess,f6 c2 c8 Nh5 Ne6 Nf3 Bg3 Bd5 Bxc7 Qxc6 Nd8 O-O a3 h2 Nc7 Nb1 Qb7 e3 dxe5 Qxd7 Na8 Qb2 b8 Qf4 Nb7 Nb5 O-O-O Nxc1 hxb5 Qe5 Ba3 Qh7 c3 a7 Rdb7 g7 h4 Bf3 Rc8 hxg3 Ng7 f7 Rgh6 g7 Rf5+ Kd1 R1b6+ Kd3 Nxh8+ Qxc8 gxf1 Ng8 Bxg8+ Kc5 Rxc4#,-0.0023566408
-0.027990516,0.0019336378,incorrect_chess,b8 a3 Ng1 Ne5 Ng5 Be3 Ba1 Nh5 Nxf4 Qe6 Nc1 Qxb3 Nxd4 Qxh3+ Kd2 Qxg5+ Kxg5 Bxe1 Na6 Bc3 Be5 Ne8 Nc2 O-O e2 Bxc5 Bb1 h1 Bxc3 gxb3 Nh4 f6 Nxg4 Rc2 Ng8 h8 Nxa4 Bh5 Nc8 h8 Ng6 Ba2 Ne2 Kf4 h1 Kd1 Kh1 Rbe8 g4 g7 exe7+ Kxc8 Bc6 Bxf5 Rxf3 Rh3 Nxd5+ Kd4 Nh4 Rh3+ Kh8 Rxf4 f7+ Ke7 Nxa1 Rg8+ Nh7+ Kf7 Re1#,0.014588554
-0.06216248,0.009727529,incorrect_chess,d4 c6 exd7 Qxe2 Na3 Qc5 a2 h2 Ba4 Qf6 d7 Na6 Ne3 Bb1 Bg6 g1 Nc3 Bxd5 Qxc8 Ba7 d4 O-O Be4 Qh8 Be1 Bc6 Nf2 Qb6 O-O Nbf3 a8 Bxh1 Bxe5 Ne8 Bb1 Nxe4 Qc8 Nf4 Rh8 Nf8 Nd8 Nf8 Qh5 Ng3 Qe1 Nd1 Qg5 Rab1 Rag1 Ng5 Qh2 Nxh4 dxd3 Ng7 Qa5 Rf7 e5 c6 a5 Ne8 Bf2 Rfd1 Rc7 d6 Be7 Qxe2 Bxg8 Rxh4 Qxe2 Rc6 Rc7 Qc7 Qa5 Qh6 Qf1 Qb5 Qa7 Qxc1 Rxa8 Rxa4 Rf4 Rxg3 gxe5 Kd5 Ke2 Ke2 Kg4 Kg2 a1 d6 d4 f8,-0.020527694
-0.015642395,-0.01952949,incorrect_chess,g6 Na7 e4 h4 Nh2 Ba6 b3 a7 b2 O-O Bh5 h3 a2 h1 e4 exh7 cxe1 Rh1 Ngc4 Ng2 O-O Nf5 Ba7 h6 Bxe2 Bxe6 b5 e8 axb1 axb5 Rxf5 Qxf2 Ba5 d6 Na6 Bf2 Bxf8 Rxa5 Ne3 Be3 e5 Qc4 Nh5 Bxd5 bxg6 Qxf1 Kb8 f3 b7 Na5 Qe6 g1 gxd6 Nxf2 Nd5 Nxg3+ hxc1 Qb8 Qf4+ Kd1 Rb8 Qxc3+ Rb6 a3,-0.006479526
0.08507783,0.0023930303,incorrect_chess,f3 h1 Nh7 Ng4 Bd3 Ne8 O-O Nxh8 Ra1 d4 d4 e6 Bxe3+ bxh4 dxh6 Bd2 exd7 Qb4 Rxf2+ Bc8 Bc6 Qb3 Bxg4,0.018906787
0.15248775,0.063419506,incorrect_chess,d3 d4 Bd1 Nc7 f5 g5 a4,-0.02229682
0.10248003,0.024397053,incorrect_chess,c6 a3 Bb4 a8 g7 g6 Nd5 h6 b8 Bg1 f2 Bg4 b2 Nc6 Qc2 Nc8 O-O-O Be7 Ne5 Ng3 Nxf6#,-0.0052227066
0.107559256,0.017993014,incorrect_chess,d4 f1 g2 Nc3 Nb3 h2 a8 Bd3 d4 O-O Bg6 Nc1 Ne1 f6 Nxb3 Rf7 f7 Na8 Qxa5 b8 Qe3,0.00080890895
-0.012937713,-0.012318586,incorrect_chess,e7 g6 Ng3 Ba7 b1 a5 h1 Ng6 Bg8 O-O Nbb2 Bb7 O-O h3 e6 Nbg3 Qg6 d5 e7 Bxb3 Nxa1 f3 Bh6 Re5 a2 bxg5 Bxh2 d8 dxc1 fxd3 Raa2 a7 exf1 exf1 Rxh7+ Qxe5 Rc7 Qb1 Bxb1 Bxf1 Bxf1+ Kc1 Bg6 Ng4 Qf5 Rg8 Qa1 Rb3 g4 Nxc4 Qxe8 Ra3 Rxe5 Qxe2+ Kg7,0.0024359843
-0.0316444,-0.010589044,incorrect_chess,Na1 e8 f1 Bb8 h5 d8 Nc3 Na7 c3 O-O Bb1 h6 Qh5 e1 O-O c6 Be8 dxa6 Bxg2 b1 Bb1 Nf6 Nxd4 Qxd7 d5 Be7 e1 Ne3 Bf8 Nb5 b3 fxc2 Bxa8 Qb8 Nh2 Bxe1 dxb4 Qc5 Rfc6 Raf3 Re7 Ng1 Rab6 Na3 Bf5 Qxc4 Bxd1 Ne3 Bxh6 Kxb5 Re5 Kg6 g1 d5 a2 Ng7 Rc4 Nh8 Rc2 Nh3 Rd4 Nh2 c2 Rd1 d2 a5 c8 Rh7 c4 Re4 Bxe1,-0.012562333
-0.024476396,0.0045650904,incorrect_chess,b6 b8 Bc4 e3 f4 d8 axf1 cxb1 Bh7 e5 Bf6 Nb4 Bxf7 Nb7 Bxf6 d8 Bxc1 e5 Bd1 h6 d4 Bf6 g5 e4 cxe3 Bxg4 c5 Qf6 exe1 Qxa5 Qf6+ Qf2 Qxc4+ Ne7 Qg3+ Kd4 Qh8 Ne7 Qxg6 Nh2 Qxg7 Be8 Qxg2 Nb1 Qxh6 Nb1 Qd4 Na5 Qc6+ Kd8 Qxe1 Ke5 Qxc8+ Kd1 h1 d4 f8+ Kf2 c8 Kb3 Be4 Kh6 h5 b8 Qf2#,0.02131807
