PCA1,PCA2,label,sentence,PCA3
-0.070654504,0.01577389,correct_chess,d4 d5 Nc3 c5 dxc5 Nf6 Bg5 e6 Bxf6 Qxf6 Nf3 Bxc5 e4 Bb4 Bb5+ Nc6 Bxc6+ bxc6 O-O Ba6 e5 Qd8 Re1 Qa5 a3 Bxc3 bxc3 Qxc3 Re3 Qa5 Nd4 Qc7 Rc3 Qxe5 Rxc6 Bb7 Rc7 Qxc7 Nb5 Qb6 a4 a6 Nc3 Rc8 Rb1 Qa7 Ne2 O-O Nf4 Rc4 g3 Rfc8 Qh5 Rxf4 gxf4 Rxc2 Qh4 Rc8 Qe7 Rb8 a5 Bc6 Qd6 Rxb1+ Kg2 Qa8 Kg3 Rb3+ f3 d4 Kh4 Rxf3 h3 Qe8 Qxd4 e5 fxe5 Qe7+ Kg4 h5+ Kxh5 Rxh3+ Kg4 Qh4+ Kf5 Rf3+,-0.022441145
-0.027260626,-0.01510305,correct_chess,e4 c5 Nf3 e6 c3 d5 e5 f6 d4 fxe5 Nxe5 Nf6 Nd2 Be7 Ndf3 O-O Bd3 Nc6 Bc2 Bd6 O-O cxd4 cxd4 Nd7 Bf4 Ncxe5 Bxe5 Bxe5 Nxe5 Qf6 Re1 Qxf2+ Kh1 Nxe5 dxe5 Bd7 Qd3 g6 h4 Bb5 Qxb5 Qxh4+ Kg1 Rf4 Qd3 Raf8 Rf1 Rxf1+ Rxf1 Rd8 Qh3 Qd4+ Qe3 Qg4 Qf3 Qxf3 Rxf3 Rc8 Rc3 Rf8,-0.018130364
0.010275422,-0.016287748,correct_chess,e4 c5 Nf3 b6 d4 cxd4 Nxd4 Bb7 Nc3 g6 Bb5 Bg7 O-O a6 Ba4 b5 Bb3 Nc6 Nf3 Nf6 Ng5 O-O h4 Na5 Bd5 Nxd5 Nxd5 Nc4 b3 Bxa1 bxc4 bxc4 c3 e6 Ba3 exd5 Bxf8 Bxc3 Ba3 dxe4 Qc2 Bf6 Qxc4 Bxg5 hxg5 Qxg5 Qc7 Bc6 Bb2 e3 fxe3 Qxg2#,0.0013758177
-0.07230899,0.006186344,correct_chess,d4 c6 c4 d5 Nc3 dxc4 Nf3 Nf6 Bg5 Bg4 e4 e6 e5 Bxf3 gxf3 h6 Bh4 g5 Bg3 Nd5 Qc2 Qb6 Bxc4 Qxd4 Bxd5 cxd5 O-O Bc5 Nb5 Qc4 Nc7+ Kd7 Qxc4 dxc4 Nxa8 Nc6 Rfd1+ Nd4 f4 Rxa8 fxg5 hxg5 b3 Kc6 bxc4 Rg8 f3 Nxf3+ Kg2 Nd4 Bf2 g4 Bxd4 Bxd4 Rxd4 Rg5 Kg3 Rxe5 Rxg4 Rc5 Rd4 Kb6 Rad1 f6 Rd6+ Ka5 Rxe6 b6 Rxf6 Rxc4 Rf5+ Ka6 Rf4 Rxf4 Kxf4 b5 Rd5 b4 Rd6+ Kb5 Re6 a5 Re5+ Ka4,-0.0381857
0.013255535,-0.02622323,correct_chess,e4 c5 Nf3 e6 c3 d5 e5 f6 d4 fxe5 Nxe5 Nf6 Nd2 Be7 Ndf3 O-O Bf4 Nc6 Bd3 c4 Bc2 Nd7 O-O Rxf4 Qd2 Rf8 h3 Bd6 Rae1 a6 Bb1 Ncxe5 Nxe5 Nxe5 dxe5 Bc5 Qc2 g6 h4 Qxh4 g3 Qh3 Qe2 Bd7 Bc2 Bc6 Bd1 d4 f3 d3+ Qf2 Bxf2+ Kxf2,-0.008792506
-0.01962413,-0.0036300358,correct_chess,d4 Nf6 c4 e6 Nc3 Bb4 Nf3 d6 Qc2 O-O a3 Ba5 Bg5 Bxc3+ Qxc3 Nbd7 O-O-O c5 e3 cxd4 exd4 b6 Qc2 Bb7 Bd3 Rc8 Kb1 d5 Bxh7+ Nxh7 Bxd8 Rfxd8 h4 Rxc4 Qd3 Rdc8 Ng5 Ba6 Qxh7+ Kf8 Qh8+ Ke7 Qxg7 Rc2 Qxf7+ Kd6 Qxe6+ Kc7 Qxd5 Bd3 Ne6+ Kb8 Rxd3,0.012250649
-0.05470094,0.00017215057,correct_chess,d4 d5 c4 c6 Nc3 e6 a3 h6 c5 Be7 Bf4 Nd7 e3 a6 b4 Ngf6 h3 b6 Bg3 Bb7 Nf3 O-O Bd3 bxc5 bxc5 Rb8 Bc2 Ra8 Qd3 Re8 Ne5 Nxe5 Bxe5 a5 Bxf6 Bxf6 Qh7+ Kf8 Ne2 g6 Nf4 e5 Nxg6+ fxg6 Bxg6 Qe7 O-O Qxh7 Bxh7 exd4 exd4 Bxd4 Rac1 Ke7 Kh2 Kd7 f4 Kc7 f5 Rf8 g4 Be5+ Kg2 Rad8 Rce1 Ba6 Rf3 Bf6 Rb1 Bb5 Kg3 a4 h4 d4 Rf2 d3 Rd2 Bc3 Rdd1 d2 Kf3 Rd3+ Kf4 Rd4+ Kf3 Rd5 g5 Re5 f6 Re1,-0.027188806
-0.0060622757,-0.0166551,correct_chess,e4 c5 d4 cxd4 Nf3 Nf6 e5 Ng4 Qxd4 d5 exd6 exd6 Bb5+ Nc6 h3 Qa5+ Nc3 Ne5 Nxe5 dxe5 Qxe5+ Be7 Bxc6+ bxc6 Qxa5 O-O O-O Bd6 Ne4 Be7 Be3 a6 Bc5 Bxc5 Qxc5 Bb7 Nd6 Rfb8 Rfe1 g6 Nxb7 Rxb7 Qxc6 Raa7 Re8+ Kg7 Qc3+ Kh6 Rae1 Rd7 Qe3+ Kg7 Qe5+ Kh6 Re4 g5 Qf6+ Kh5 g4+ Kh4 Qh6#,-0.018978503
-0.037080362,0.009445319,correct_chess,e4 b6 d4 Bb7 Bd3 Nf6 Qe2 e6 c4 Be7 Nc3 O-O h4 h6 Bf4 d6 Qd2 Ng4 Nf3 Nd7 Rh3 e5 Bxh6 Nxh6 Rg3 Bxh4 Qxh6 Bxg3 Qh3 Bf4 Nh4 g6 Ke2 Kg7 Rh1 Rh8 g3 Bg5 dxe5 Nxe5 f4 Nxd3 Kxd3 Bxh4 gxh4 Qf6 Ne2 Qxb2 f5 Rh6 fxg6 fxg6 h5 Rah8 Qd7+ Kg8 Qe8+ Kg7 Qe7+ Kg8 Qe8+ Kg7 Qe7+ Kg8 Qe8+ Kg7 Qe7+ Kg8,0.013665955
-0.062146325,0.014367605,correct_chess,d4 d5 Bg5 f6 Be3 Nc6 Nc3 e5 Nxd5 Qxd5 dxe5 Qxe5 Bd4 Nxd4 c3 Nc6 Nf3 Qb5 a4 Qxb2 g4 Qxc3+ Nd2 Bb4 Rc1 Qe5 Rc4 Bxg4 Rxg4 Nh6 Rxg7 O-O-O Bh3+ Kb8 O-O Rxd2 Qb3 Rxe2 Qf7 b6 Rxh7 Rg8+ Rg7 Rd8 Qc4 Rd4 Qxc6 Bd6 Rh7 Nf5 Rh8+ Qe8 Rxe8+ Rxe8 Qxe8+ Kb7 Bxf5 a5 Rc1 Rh4 Qc6+ Ka7 Kf1 Rxh2 Kg1 Rh5 Bg4 Rg5 f3 Rg7 Kf2 Rh7 Bc8 Rh2+ Kg1 Rh8 Qb7#,-0.0034424954
0.016993172,-0.015008114,correct_chess,e4 c5 Nc3 e6 f4 d5 Nf3 d4 Ne2 Nc6 c3 f6 cxd4 cxd4 d3 e5 Bd2 Bd7 Qb3 Qc7 fxe5 Nxe5 Rc1 Qb6 Qd5 Bc6 Qe6+ Ne7 Nexd4 Nxf3+ gxf3 Qxd4 Bh3 Qe5 Rxc6 bxc6 Qd7+ Kf7 d4 Qxd4 Be6+ Kg6 Qxd4 Kh5 Bf7+ g6 Qxf6,0.0058157165
-0.01466295,-0.007868209,correct_chess,e4 e6 e5 c5 f4 d5 d4 cxd4 Qxd4 Nc6 Qd3 Bc5 c4 d4 Ne2 Nh6 Bd2 Qb6 b3 Nf5 g4 Ne3 Bxe3 dxe3 Bg2 Bb4+ Kf1 Bd7 Nbc3 Bxc3 Nxc3 Nb4 Qd6 Qd8 Qxb4 Qh4 Ke2 Qf2+ Kd3 Qd2+ Ke4 Bc6+ Nd5 exd5+ Kf5 Bd7+ e6 Bxe6+ Ke5 Qb2+ Kd6 Rd8+ Kc5 b6+ Kc6 Bd7+ Kd6 Qf6+ Kc7 Qc6#,0.014097757
0.06269756,-0.019162001,correct_chess,d4 d5 f4 e6 e3 Nf6 Nf3 c5 c3 a6 Be2 b5 O-O Nc6 Ne5 Bb7 Nd2 Be7 Bh5 O-O Be2 c4 Ndf3 b4 h3 bxc3 bxc3 Ne4 a3 Nxc3 Qc2 Ne4 Bb2 Na5 Nd2 Nxd2 Qxd2 Nb3,0.0041844505
0.046807107,-0.010438454,correct_chess,d4 Nf6 c4 e6 Nc3 c5 Nf3 cxd4 Nxd4 Bc5 Nf3 O-O Bg5 d6 e3 Nbd7 Bd3 Qb6 Qc2 h6 Bh4 Ne8 O-O-O Qc7 h3 a6 g4 Rb8 g5 hxg5 Nxg5 b5 cxb5 axb5 Bxb5 Ba6 Qh7#,6.9433765e-05
0.0057231346,-0.015342345,correct_chess,e4 c5 d4 e6 Nf3 cxd4 c3 Nc6 cxd4 d5 exd5 exd5 Nc3 Nf6 Bd3 Be7 O-O O-O a3 Re8 Bg5 Bg4 h3 Bh5 Bf4 Nxd4 Nxd4 Bxd1 Rfxd1 Bd6 Bg5 h6 Bh4 Be7 Nf5 g5 Bg3 Bf8 Nb5 Rc8 Nxa7 Rc5 Nb5 Rxb5 Bxb5 Re6 b4 Ne4 Nd4 Qb6 Bd7 Nxg3 Nxe6 fxe6,-0.018130153
-0.018010283,-0.0146454945,correct_chess,e4 d5 e5 Bf5 d4 e6 Nc3 c5 Nf3 cxd4 Nxd4 a6 Bd3 Bg6 O-O Bxd3 Qxd3 Bc5 Nde2 Ne7 Bg5 h6 Be3 Bxe3 fxe3 Nbc6 e4 Nxe5 Qg3 O-O Qxe5 Ng6 Qg3 dxe4 Rad1 Qb6+ Kh1 Qxb2 Rb1 Qxc2 Ra1 Qb2 Rfb1 Qa3 Rb3 Qe7 Nxe4 Rfd8 Rbb1 Rd5 Rd1 Re5 Nf4 Nxf4 Qxf4 Rf5 Qg3 Rc8 Nd6 Rf1+ Rxf1,-0.027894769
0.038922146,-0.027287163,correct_chess,e4 d5 exd5 Qxd5 Nc3 Qa5 d4 c6 Bf4 e6 a3 Qd8 Nf3 Nd7 Be2 Be7 O-O Ngf6 h3 O-O Re1 Nd5 Nxd5 cxd5 c3 a6 Bd3 b5 Rc1 Nb6 Ne5 Bb7 Qh5 g6 Nxg6 fxg6 Bxg6 hxg6 Qxg6+ Kh8 Re5 Rf5 Rxf5 exf5 Be5+,-0.0018250751
-0.005657568,-0.015208411,correct_chess,e4 c5 Nf3 Nc6 c3 e6 d4 cxd4 cxd4 Nf6 Nc3 d5 e5 Nd7 Bd3 Be7 O-O f6 Bf4 fxe5 Bxe5 Bf6 Bxf6 Nxf6 Qe2 O-O Rae1 Nb4 Bb1 a6 Ne5 b5 Qf3 Bb7 Qh3 h6 Re3 Nc6 Rg3 Qe7 Qxh6 Nxe5 dxe5 Ne4 Nxe4 dxe4 f4 Rf7 Rh3 Rf5 a3 gxh6 Rxh6 Qc5+ Kh1 Bd5 g3 Kg7,0.0010385051
0.052967694,-0.016961494,correct_chess,e4 Nf6 e5 Nd5 c4 Nb6 c5 Nd5 Nc3 Nxc3 dxc3 e6 Be3 b6 cxb6 cxb6 Nf3 Nc6 Bd3 Bc5 Bxc5 bxc5 O-O O-O Qc2 g6 Rad1 Qc7 Rfe1 a5 Qd2 Rb8 b3 Rb6 Qh6 Ne7 Ng5,0.016391195
0.091090225,0.015217408,correct_chess,e4 e5 Nf3 d6 Bc4 c6 d4 b5 Bb3 f6 O-O Bg4 dxe5 Bxf3 Qxf3 dxe5 Bg5 h6 Bh4 Nd7 Rd1 g5 Qh5+ Ke7 Qf7#,0.00017692239
4.0613315e-05,-0.010610125,correct_chess,d4 Nf6 c4 e6 Nc3 c5 Nf3 cxd4 Nxd4 Bc5 Nf3 O-O Bg5 h6 Bh4 d6 Bg3 Nbd7 e3 Qb6 Qc2 d5 cxd5 exd5 Be2 Re8 O-O a6 Na4 Qa5 Bh4 Be7 Nd4 b5 Nc3 Nc5 Nc6 Qb6 Nxe7+ Rxe7 Bxf6 Qxf6 Nxd5 Qg5 Nxe7+ Qxe7 Rac1 Ne4 Bf3 Ng5 Bxa8 Nh3+ gxh3 Bxh3 Bg2,-0.0025565994
0.040878326,-0.025171356,correct_chess,e4 c5 Nf3 b6 d4 cxd4 Nxd4 Bb7 Nc3 g6 Bc4 Bg7 O-O Nc6 Nf3 e6 Bf4 Nge7 Bd6 Nc8 e5 Nxd6 Qxd6 Na5 Bb5 a6 Bd3 b5 Be4 Nc4 Qb4 Bxe4 Nxe4 Qe7 Nd6+ Nxd6 exd6 Qf6 c3 O-O Qd4,0.010991095
-0.03856542,0.018669866,correct_chess,e4 c5 d4 e6 Nf3 d5 exd5 exd5 dxc5 Nf6 Nc3 Nc6 Be2 Bxc5 O-O Be7 Bg5 O-O Bxf6 Bxf6 Nxd5 Bxb2 Rb1 Bf6 c4 Bg4 h3 Bh5 Qb3 Rb8 Qa3 Bxf3 Bxf3 Nd4 Be4 Ne2+ Kh1 Re8 f3 Bh4 Qxa7 Ng3+ Kh2 Nxf1+ Rxf1 Qd6+ f4 Rxe4 c5 Qd8 f5 h6 f6 Ra8 Qxb7 Bxf6 Nxf6+ gxf6 Qxe4 Rc8 Qg4+ Kh7 Qf5+ Kg7 a4 Qc7+ Kh1 Qxc5 Qxf6+ Kh7 Qxf7+ Kh8 Qf6+ Kh7 Qf7+ Kh8 a5,-0.0093522025
0.04576848,-0.014168981,correct_chess,d4 d5 c4 c6 Nc3 e6 a3 a6 c5 h6 Bf4 Nf6 e3 Be7 h3 Nbd7 Nf3 b6 b4 Bb7 Bd3 Ne4 Nxe4 dxe4 Bxe4 Nf6 Bc2 O-O Qd3 e5 Bxe5 g6 Nh4 Nh5 Nxg6 fxg6 Qxg6+ Ng7 Qxg7#,0.008418755
-0.07789201,0.019999262,correct_chess,d4 Nf6 c4 e6 Nc3 c5 Nf3 cxd4 Nxd4 Bc5 Nf3 O-O Bg5 h6 Bh4 d6 Bg3 Nbd7 e3 Qb6 Qc2 d5 cxd5 exd5 Be2 Bb4 O-O Nc5 Rab1 Nce4 Ne5 Nxg3 hxg3 Qd6 f4 d4 Nb5 Qd8 Nxd4 Nd5 Qd3 Bc5 Qe4 f5 Qf3 Bxd4 exd4 Nb4 Bc4+ Kh8 Ng6+ Kh7 Nxf8+ Qxf8 Rfe1 a6 a3 Nc6 Bd3 Nxd4 Qh5 Qc5 Re5 Nf3+ Kf1 Nxe5 fxe5 Qxe5 Bxf5+ Bxf5 Qe2 Qxe2+ Kxe2 Bxb1 Kd2 Bc2 g4 Bb3 g5 b5 g6+ Kxg6 Kc3 Kf6 Kb4 a5+ Kxb3 a4+ Kc3 Rb8 Kb4 Rc8 g3 Rc4+ Kxb5 Rg4 Ka5 Rxg3 Kxa4 Rb3 Kxb3 h5 a4 h4 a5 h3 a6 h2 a7 h1=Q a8=Q Qxa8,-0.00946604
0.11578663,0.043513827,correct_chess,e4 e5 Nf3 d6 Bc4 Bg4 Bxf7+ Kxf7 d4 exd4 Ng5+ Ke8 Qxg4 Qf6 Qc8+ Ke7,-0.0020044704
0.03855875,-0.011870655,correct_chess,d4 d5 Bg5 Bg4 Nf3 Nf6 Bxf6 Bxf3 Bxg7 Bxg2 Bxg2 Bxg7 Nc3 Nc6 Bxd5 Bxd4 e3 e6 Bxc6+ Qd7 Bxd7+ Kxd7 exd4 c6 Qh5 b6 Qxf7+ Kd6 O-O Rhf8 Qh5 Rg8+ Kh1,0.01612186
-0.0022890538,-0.01704787,correct_chess,e4 c5 d4 e6 Nf3 d5 exd5 exd5 Bb5+ Nc6 O-O Nf6 Re1+ Be7 Bf4 O-O Nc3 a6 Bd3 c4 Be2 Bg4 h3 Bh5 g4 Bg6 Ne5 Nxe5 dxe5 Nd7 Nxd5 Bc5 Bxc4 b5 Bb3 h5 e6 fxe6 Nc7 Rxf4 Nxa8 Bxf2+ Kg2 Bxe1 Bxe6+ Kh8 Qxe1 Qxa8+ Kg3 Qf3+ Kh4 hxg4 Bxg4 Qd5 Qe3 Rf6 Rd1,-0.00615369
-0.0871598,0.037932362,correct_chess,e4 e6 f4 b6 Nf3 Bb7 Nc3 Ne7 Be2 Ng6 d3 Nh4 Nxh4 Qxh4+ g3 Qh3 Bf1 Qh6 Bg2 Qf6 Qe2 Qd8 Bd2 Bb4 O-O-O Bxc3 Bxc3 Na6 a3 Nc5 Bxg7 Rg8 Bh6 Rg6 Bg5 f6 f5 Rxg5 fxe6 Nxe6 h4 Nd4 Qe3 Rxg3 Qxd4 Rxg2 Rhg1 Rxg1 Rxg1 Qe7 Rg8+ Kf7 Rxa8 Bxa8 Qc4+ Kg6 Qxc7 Kh5 Qxa7 Qf8 Qxb6 f5 Qb5 Bc6 Qxf5+ Qxf5 exf5 Kxh4 Kd2 Kg5 f6 Kxf6 b4 h5 Ke3 h4 Kf2 Kg5 Kg1 Kg4 Kh2 h3 c4 d5 b5 Bb7 c5 d4 c6 Bc8 b6 Kf3 b7 Bxb7 cxb7 Ke3 b8=Q Kxd3 Qb3+ Ke4 Qxh3 d3 Qf1 Ke3 Qe1+ Kd4 a4 Kc4 a5 Kb3 a6 Kc2 a7 d2 Qe4+ Kc1 Qc4+ Kd1 a8=Q Ke1 Qa1+ d1=Q Qe4+ Kd2 Qed4+ Ke1 Qdxd1+ Kf2 Qf6+ Ke3 Qe5+ Kf2 Qde2#,0.020865167
-0.05305166,0.0003741186,correct_chess,d4 Nf6 c4 e6 Nc3 c5 Nf3 cxd4 Nxd4 Bc5 Nf3 O-O Bg5 h6 Bh4 d5 Qc2 d4 Ne4 Be7 Nxd4 Qxd4 Nxf6+ Bxf6 Bxf6 Qxf6 e3 Nc6 Be2 Nb4 Qb3 a5 O-O e5 a3 Nc6 Bd1 Qg5 Bc2 Bh3 g3 Bxf1 Rxf1 a4 Qd3 f5 Qd5+ Kh8 c5 Rad8 Qe6 Rf6 Qc4 f4 exf4 exf4 Qe4 g6 Re1 f3 Qh4 Qxh4 gxh4 Nd4 Bd3 Rf5 Bxf5 Nxf5 h3 Nxh4 Kh2 Ng2 Rc1 Nf4 c6 bxc6 Rc5 Ne2 Rxc6 Nd4 Rxg6 Kh7 Ra6 Nf5 Ra7+,-0.037636504
0.010921627,-0.018591255,correct_chess,e4 d5 exd5 Qxd5 Nc3 Qa5 d4 c6 Nf3 Bg4 Be2 e6 O-O Be7 h3 Bxf3 Bxf3 Nf6 Bd2 Qd8 Qe2 Nbd7 Rad1 Nd5 Nxd5 cxd5 Qb5 Qb6 Be2 a6 Qxb6 Nxb6 Ba5 Nd7 Rd3 b5 Rg3 O-O Bd2 Rfc8 c3 Nf6 Bh6 g6 h4 Bf8 Bg5 Ne4 Rg4 h5 Rf4 Nxg5 hxg5 Be7 g4 Bxg5,-0.023410998
0.02954555,-0.02969224,correct_chess,e4 d6 d4 Nd7 Nf3 b6 Bd3 Bb7 O-O Ngf6 e5 dxe5 dxe5 Bxf3 Qxf3 Nxe5 Bb5+ c6 Bxc6+ Nxc6 Qxc6+ Nd7 Bf4 Rc8 Qa4 a5 Nc3 e6 Rad1 Rc5 Rd3 f6 Rfd1 b5 Nxb5 Qb6 Nc7+ Rxc7 Bxc7 Qxc7 Rxd7 Qe5 Rxg7+,0.0059687416
-0.043200694,0.0031322301,correct_chess,e4 c5 Nf3 e6 Nc3 d5 exd5 exd5 d4 Nf6 Bb5+ Nc6 O-O Be7 Re1 O-O Bf4 a6 Bxc6 bxc6 dxc5 Bxc5 Na4 Ba7 c4 Ng4 Be3 Nxe3 fxe3 Bg4 cxd5 cxd5 Nc3 d4 exd4 Bxf3 Qxf3 Bxd4+ Kh1 Re8 Red1 Qb6 Nd5 Qc5 Rac1 Qa7 Nc7 Rac8 Nxe8 Rxc1 Rxc1 Qe7 Qc6 Bxb2 Rd1 g6 h3 Be5 Qd7 Qg5 Nd6 Kg7 Qxf7+ Kh6 Ne4 Qf4 Qxf4+ Bxf4 Nf2 Bc7 Ng4+ Kg5 Rd7 Bb6 Rxh7 Bd4 g3 Bb2 Kg2 Kf5 Kf3 Ke6 Rf7 Kd6 Ne5,-0.022123089
0.06428109,0.0044894335,correct_chess,e4 e5 Qh5 d6 Bc4 Qe7 d3 Nf6 Qf3 Bg4 Qg3 Nc6 h3 Bd7 d4 Nxd4 Qc3 Nxe4 Qb4 Nxc2+ Kd1 Nxb4 Bd3 Nxf2+ Ke2 Nxh1 Be4 Qf6 Kd2 Qf2+ Ne2 d5,-0.0002344008
0.009211467,-0.02295783,correct_chess,c4 e5 Nc3 d6 d4 exd4 Qxd4 Nc6 Qd5 Nf6 Qd1 Bf5 a3 Be7 g3 O-O Bg2 Ne5 Bxb7 Rb8 Ba6 Rb6 Bb5 d5 f4 Nxc4 Nf3 Bc5 b4 Be3 Bxc4 Bxc1 Rxc1 dxc4 Qxd8 Rxd8 O-O a5 bxa5 Ra6 Nb5 Rxa5 Nxc7 Rxa3 Rxc4 Ra2 Nh4 Bg4 e4 Be2 Rfc1 Bxc4 Rxc4 Rd1#,-0.011307833
0.032163717,-0.022258362,correct_chess,e4 c5 Bc4 e6 e5 d5 Bb5+ Bd7 Bxd7+ Nxd7 Nf3 Nh6 d4 Nf5 O-O Rc8 Bg5 f6 exf6 Nxf6 Bxf6 Qxf6 c3 Bd6 Qa4+ Ke7 Qxa7 Rhf8 Re1 Kf7 Ne5+ Bxe5 dxe5 Qh4 Qxb7+ Kg8 Qb6 Ne3 Rxe3 Qxf2+,0.013044202
-0.015725475,-0.015684472,correct_chess,d4 Nf6 c4 g6 Nc3 Bg7 Nf3 O-O Bg5 d5 e3 dxc4 Bxc4 a6 Bd3 b5 Qc2 Nbd7 O-O-O Qe8 h4 c5 dxc5 Nxc5 Kb1 Be6 Nd4 b4 Nxe6 Nxe6 Ne4 Rc8 Qd2 Nd5 h5 f5 Ng3 Nxg5 hxg6 b3 gxh7+ Kh8 Nxf5 a5 Nxg7 Kxg7 Ba6 Nb4 Qd4+ e5 Qa7+ Kh8 Bxc8 Qg6+ Ka1 Nc2+ Kb1 Na3+ Ka1 Qb1+ Rxb1 Nc2#,-0.016569462
-0.013692813,-0.0075578843,correct_chess,e3 e5 g3 Nc6 b3 Bc5 Bb2 d5 a3 Be6 f4 exf4 gxf4 Nf6 Nf3 Ne4 Ng5 Nxg5 fxg5 Qxg5 Qf3 Qh4+ Qf2 Qxf2+ Kxf2 d4 exd4 Bxd4+ Ke2 Bxb2 Rg1 Bxa1 Rxg7 Nd4+ Ke3 O-O-O Rg5 Nxc2+ Ke2 Nd4+ Kd3 Nf3+ Ke4 Nxg5+ Kf4 h6 Kg3 Rhg8 Kh4 Ne4 Kh5 Bg4+ Kxh6 Rd6+ Kh7 Rdg6 Bg2 Ng5#,0.00747851
-0.09061626,0.032365993,correct_chess,d4 d6 Bg5 f6 Bh4 g5 Bg3 c6 e3 Qb6 b3 Na6 h4 Bf5 Qh5+ Bg6 Qe2 Nb4 Na3 O-O-O h5 Bd3 Qg4+ Kc7 Bxd3 Nxd3+ cxd3 Qb4+ Ke2 Qxa3 Nf3 Qb2+ Nd2 Nh6 Qe6 f5 Rab1 Qxa2 Rhc1 f4 exf4 gxf4 Bxf4 Bg7 d5 c5 Qxe7+ Kc8 Qxg7 Rhe8+ Kd1 Nf5 Qxh7 Nd4 Be3 Rd7 Qg6 b6 Qxe8+ Kc7 Bxd4 a5 Rb2 Qa3 Rc3 Qxb2 Rc2 Qxd4 f3 Qxd5 Ne4 Qxd3+ Rd2 Qxb3+ Ke2 Qc4+ Rd3 d5 Nf6 Qc2+ Rd2 Qc4+ Rd3 Rd8 Qe5+ Kc6 Qe7 Rd6 Nxd5 Rxd5 Qe6+ Kb5 Qxd5 Qc2+ Rd2 Qc3 Qd3+ Qxd3+ Rxd3 a4 h6 Kb4 h7 a3 h8=Q c4 Qf8+ Kb5 Qxa3 cxd3+ Qxd3+ Kc5 f4 b5 f5 b4 f6 b3 Qxb3 Kd6 f7 Ke7 Qf3 Kf8 g4 Kg7 f8=Q+ Kg6 Q3f5#,0.012128067
-0.016743917,-0.0039655757,correct_chess,e4 e5 f4 exf4 Nf3 d5 e5 Nc6 d4 Bg4 Bxf4 Qd7 c3 O-O-O Nbd2 Kb8 Be2 f6 h3 Be6 O-O g5 Bg3 h5 b4 g4 Nh2 gxh3 b5 hxg2 Rf3 Nce7 Bd3 f5 Bh4 Bh6 c4 Bxd2 Qxd2 Nh6 Bxe7 Qxe7 c5 Rdf8 b6 axb6 Rb1 bxc5 Qb2 b6 Ba6 cxd4 Qxd4 Ng4 Rxb6+ Ka8 Bb7+ Ka7 Rxe6+ Kxb7 Rxe7 Nxh2,-0.0071250973
0.14958264,0.061940216,correct_chess,g3 d5 f4 Bf5 Bg2,-0.007791072
0.15096085,0.053821903,correct_chess,e3 e5 d4 Nc6 d5,-0.0155961905
-0.0010845613,-0.017661521,correct_chess,d4 Nf6 Nf3 e6 Nbd2 c5 b3 cxd4 Bb2 Nc6 Nxd4 Nxd4 Bxd4 d5 e3 Bd6 Nf3 Qa5+ c3 O-O Bd3 Nd7 e4 e5 b4 Qc7 Bc5 Bxc5 exd5 Bd6 Qc2 f5 Ng5 e4 Be2 Ne5 O-O Bxb4 Qb3 Qxc3 Qa4 Bd7 Qd1 Qd2 Ne6 Qxd1 Bxd1 Bb5 Nxf8 Kxf8 Rb1 Bxf1 Rxb4 Bc4 Bb3 Rc8 Rxb7 Bxd5,-0.018480293
-0.058531757,0.016505301,correct_chess,e4 e5 Bc4 c6 Nc3 b5 Bb3 Ba6 d3 c5 a3 b4 axb4 cxb4 Rxa6 Nxa6 Nd5 Nf6 Qf3 Nc5 Nxf6+ gxf6 Ba2 Bg7 Be3 Qa5 Bd5 b3+ c3 Qa1+ Qd1 Qxb2 Bxa8 Qxc3+ Qd2 Qxd2+ Kxd2 b2 Kc2 Na4 Ne2 Ke7 Bd5 Rc8+ Kb1 Bf8 Bb3 Nc5 Kxb2 Nxd3+ Ka2 Nxf2 Rc1 Kd8 Rxc8+ Kxc8 Bxf2 a5 Nc3 Kc7 Nb5+ Kc6 Nc3 Bh6 Bxf7 Bd2 Bd5+ Kd6 Na4 Kc7 Bb6+ Kd6 Bd8 Bg5 g3 Be3 Bxf6 Bd4 Bg8 h6 Bg7 Kc6 Bxh6 Kb5 Nb2 d6 Bf8 Bc5 h4 Kb4 h5 Kc3 h6 Kd4 h7 Kxe4 h8=Q d5 Qh4+,0.010107535
0.020899208,-0.018141702,correct_chess,e4 e5 Nf3 Nc6 Bc4 Bc5 c3 Nf6 d3 h6 O-O d6 h3 Be6 Bxe6 fxe6 Qb3 O-O Qxe6+ Kh8 b4 Bb6 Nbd2 Nh5 Qb3 Nf4 Nc4 Nxd3 Rd1 Nxf2 Nxb6 Nxd1 Nc4 Rxf3 gxf3 Qh4 Qxd1 Qg3+ Kf1 Qxh3+ Ke2 Rf8 Nd2 Qg2+ Kd3,-0.0029564057
0.011149027,-0.017917171,correct_chess,e3 Nc6 g3 Nf6 Bg2 d5 b3 e5 Bb2 Bd6 Qf3 Bg4 Qxf6 gxf6 Bh3 Bxh3 Nxh3 Qe7 f4 exf4 Nxf4 Bxf4 gxf4 O-O-O Rg1 Rhg8 Rxg8 Rxg8 Ke2 Rg2+ Kf1 Rxh2 Kg1 Re2 Nc3 Rxd2 Bc1 Rxc2 Nxd5 Qe4 Nxf6 Qg2#,0.010551216
-0.014886693,-0.013753971,correct_chess,e4 d6 Nf3 g6 d4 Bg7 Be3 Nd7 Bc4 Ngf6 Nbd2 O-O O-O c6 c3 Qc7 Bd3 b5 Qc2 e5 Rac1 exd4 cxd4 Re8 e5 dxe5 dxe5 Nxe5 Nxe5 Qxe5 Qxc6 Bd7 Qc3 Nd5 Qxe5 Bxe5 Bc5 Bxb2 Rc2 Be5 Nf3 Bg7 Re1 Bg4 h3 Bxf3 gxf3 Rxe1+ Kg2 Rae8 Be4 Nf4+ Kg3 Ne6 Bb4 Ra1 a3 Be5+ Kg2 Nf4+ Kh2 Ne2+ Kg2 Rg1#,-0.014079881
-0.020688824,-0.008685044,correct_chess,e4 c5 Nf3 d6 d4 cxd4 Nxd4 Nf6 Nc3 Nc6 Bb5 Bd7 Nxc6 bxc6 Bd3 e5 O-O Be7 Bd2 O-O a3 Be6 b4 d5 Bg5 d4 Ne2 h6 Bxf6 Bxf6 f4 Bg4 Qd2 exf4 Qxf4 Bxe2 Bxe2 d3 Bxd3 Bxa1 Rxa1 Qd4+ Kf1 Qxa1+ Ke2 Qxa3 e5 Qc3 Qe4 g6 h4 h5 g4 hxg4 h5 Qxe5 Qxe5 Rfe8 Qxe8+ Rxe8+ Kf2 gxh5 Kg3,-0.0026370604
-0.03786993,0.0028121779,correct_chess,d4 d5 Nc3 Nf6 f3 e6 e4 Bb4 e5 Bxc3+ bxc3 Nfd7 Ba3 b6 Ne2 c5 f4 O-O Ng3 c4 Bxf8 Qxf8 Qg4 Qa3 Nh5 g6 Nf6+ Kg7 Nh5+ Kg8 Ng3 Qxc3+ Kf2 Qxa1 Bd3 Qxa2 Bxg6 fxg6 Qxe6+ Kf8 Qd6+ Ke8 Qe6+ Kd8 Qg8+ Kc7 Qxh7 Qxc2+ Ne2 Nc6 e6 Nxd4 Re1 Nxe6 Kf1 Nf8 Qe7 Qe4 Qg7 Qf5 Nd4 Qxf4+ Kg1 Qxd4+ Kh1 Qxg7,0.010353715
-0.0110964235,-0.016039848,correct_chess,d4 d5 Bf4 e6 Nf3 h6 e3 Nf6 Nc3 a6 Bd3 c5 dxc5 Bxc5 O-O Nc6 a3 O-O b4 Be7 h3 Nh7 Ne2 Ng5 c4 Nxf3+ gxf3 d4 exd4 Nxd4 Nxd4 Bf6 Nb3 Bxa1 Qxa1 Qh4 Bg3 Qxh3 Be5 f6 Bd6 Rd8 c5 e5 Nd2 Qh5 Be2 Qg5+ Kh2 Qxd2 Bc4+ Kh8 Kg3 Qf4+ Kg2 Qxc4 Be7 Rd4 Qb1 Rh4,-0.0021209123
0.04071086,-0.021560159,correct_chess,e4 c5 Nf3 d6 d4 cxd4 Nxd4 Nf6 Nc3 a6 Be2 e6 Be3 Bd7 f3 Nc6 Qd2 Nxd4 Bxd4 Be7 O-O-O Qc7 Kb1 O-O g4 h6 h4 e5 Be3 Nh7 g5 hxg5 hxg5 Nxg5 Bxg5 Bxg5 Qxg5 b5 Rdg1 g6 Qh6,0.0069018486
0.052838843,-0.023190264,correct_chess,e4 c5 Nf3 e6 d4 d5 dxc5 Bxc5 exd5 exd5 Nc3 Nf6 Bg5 O-O Bxf6 Qxf6 Qxd5 Re8+ Be2 Bb4 Qd3 Bf5 Qd2 Rd8 Qe3 Nc6 O-O Re8 Qc1 Bxc3 bxc3 Qxc3 Bd3 Bxd3,0.016052369
0.00024247193,-0.022947373,correct_chess,c3 d5 e3 e5 d4 exd4 cxd4 Nf6 Bd3 Bd6 Bd2 O-O Nc3 Nbd7 Nge2 c6 Qc2 Qe7 a3 Re8 b4 b6 a4 c5 bxc5 bxc5 dxc5 Bxc5 a5 Bb7 O-O d4 exd4 Bb4 Nd5 Nxd5 Bxb4 Nxb4 Qc3 Nxd3 Qxd3 Qxe2 Qxe2 Rxe2 a6 Bd5 Ra5 Bc4 Rc5 Nxc5 dxc5 Bxa6 Rc1 Rae8 c6 Re1+,-0.017015496
0.03996254,-0.021901527,correct_chess,e4 c5 Nf3 Nc6 d4 cxd4 Nxd4 g6 Nc3 Bg7 Be3 e6 f3 Nge7 Be2 d5 exd5 Nxd5 Nxd5 Qxd5 Qd2 Nxd4 O-O-O Nxe2+ Qxe2 Qxa2 Qb5+ Ke7 Bc5+ Kf6 Bd4+ Ke7 Qb4+ Ke8 Bxg7 Rg8 Bf6 a6 Qe7#,0.015456593
0.016071616,-0.01217395,correct_chess,e4 e5 Nf3 f5 exf5 e4 Nd4 Nf6 Nc3 c5 Nb3 d5 d4 c4 Nd2 Nc6 Be2 Nxd4 O-O Bxf5 Bh5+ Nxh5 Qxh5+ g6 Qd1 Bd6 Nb3 Nxb3 axb3 Be5 Qxd5 Qc7 bxc4 Bxh2+ Kh1 Rd8 Qb5+ Bd7 Qg5 Be5 Nxe4 Qxc4 Qxe5+ Kf7 Nd6+,0.0027375636
0.064235754,-0.015064873,correct_chess,e4 e5 Nf3 Nc6 Bc4 Bc5 Nc3 Nf6 Ng5 O-O a3 h6 Nf3 d6 h3 Ne7 d4 exd4 Nxd4 Bxd4 Qxd4 Ng6 O-O Bd7 Nd5 Nxd5 exd5 Qc8 Qc3 b5 Bxb5 Bxb5,0.013017657
0.058995277,-0.0056483992,correct_chess,e4 d5 exd5 Nf6 Nc3 e6 Bc4 Bb4 Qf3 Nbd7 b3 Nc5 Bb2 Bxc3 Bxc3 O-O dxe6 Bxe6 Bxe6 Re8 Ne2 Rxe6 O-O Qe7 Nf4 Rc6 Bxf6 Qxf6 Rfe1 Nd7 Re2 Qxa1+ Re1 Qxe1#,-0.005203326
-0.024196297,-0.018771792,correct_chess,Nf3 c5 c4 e6 Nc3 d5 cxd5 exd5 d4 Nf6 Bg5 Be7 e3 cxd4 Nxd4 O-O Bb5 Bg4 f3 Bh5 O-O Bg6 Bd3 a6 Qd2 Nc6 Rac1 Nb4 Bxg6 hxg6 a3 Nc6 Nb3 Nh7 Bxe7 Qxe7 Nxd5 Qd6 Rfd1 Ng5 Nf4 Qf6 Nd4 Ne5 h4 Nh7 Qf2 Nd7 Nd5 Qe5 e4 Nb6 Nxb6 Rad8 Nc4 Qh5 Ne2 Nf6 Nf4 Qh6 Rxd8 Rxd8 Qe3 Qxh4 Rc3 Rd1+ Qe1 Rxe1#,-0.025781652
-0.07355135,0.011216217,correct_chess,e4 c5 Nf3 d6 d4 cxd4 Nxd4 Nf6 Nc3 a6 Be2 e6 Be3 Be7 f3 O-O Qd2 Qc7 O-O-O Nbd7 Kb1 h6 g4 Qd8 h4 Nh7 Bf2 e5 Nb3 f6 f4 exf4 Qxf4 Ne5 Bd4 Re8 Bxe5 fxe5 Bc4+ Kh8 Qf3 Bxh4 Rdg1 Bg5 Nd5 b5 Bd3 Be6 Ne3 Bxb3 cxb3 Rb8 Nf5 Qf6 Rf1 g6 Nxh6 Qxf3 Rxf3 Bxh6 Rxh6 Kg7 g5 Nxg5 Rhh3 Nxf3 Rxf3 a5 Rf1 g5 Rd1 a4 Be2 axb3 axb3 Red8 Rd5 b4 Rd1 Kf6 Rf1+ Kg6 Rf5 Rf8 Rxf8 Rxf8 Bc4 g4 Ka2 Kg5 Be6 Kf4 Bc4 Kxe4 Bf1 Kf3 Bd3 g3 Bc4 g2 Bf1 gxf1=Q,-0.022163726
-0.077446364,0.013684806,correct_chess,d4 Nf6 c4 e6 Nc3 Bb4 Nf3 c5 Qc2 cxd4 Nxd4 Nc6 Nf3 O-O a3 Bxc3+ Qxc3 d5 Bg5 d4 Qc2 Bd7 Qd3 h6 Bh4 g5 Bg3 Nh5 e3 dxe3 fxe3 Qa5+ b4 Nxb4 Qc3 Nc6 Qxa5 Nxa5 Bd6 Rfe8 Ne5 Bc6 O-O-O Rad8 c5 Nb3+ Kb2 Na5 Bd3 Nf6 h4 Ne4 hxg5 hxg5 Rh6 Nf2 Rd2 Nxd3+ Rxd3 b6 e4 bxc5 Rdh3 Rxd6 Rh8+ Kg7 R3h7+ Kf6 Ng4+ Ke7 Rxe8+ Bxe8 Rh8 Rd2+ Kc3 Rxg2 Ne5 Rg3+ Kd2 Nc6 Rh7 Nxe5 Ke2 Rd3 Rh6 Rxa3 Rh5 Ra2+ Ke3 Kf6,-0.021517431
0.08042726,-0.0058244076,correct_chess,e4 e5 Nf3 Nc6 Nc3 g6 Bc4 Bg7 Ng5 Nh6 Nf3 d6 d3 O-O Bg5 Ne7 Nd5 c6 Nxe7+ Kh8 Qd2 Qd7 O-O-O Ng4 d4 f6 Nxc8,0.016040504
-0.02634469,-0.008239406,correct_chess,e4 e6 Nf3 d5 exd5 exd5 Be2 Nf6 O-O Bd6 d3 Bg4 Nc3 h6 Re1 O-O a3 c6 b4 Nbd7 Rb1 Qb6 Na4 Qc7 c4 dxc4 dxc4 Bxf3 Bxf3 Bxh2+ Kh1 Bf4 g3 Be5 c5 Rad8 Qb3 b6 cxb6 axb6 Nc3 c5 Nd5 Nxd5 Bxd5 Nf6 Bg2 cxb4 Be3 Bd6 Rbc1 Qb8 axb4 Rfe8 f3 Bxg3 Rg1 Bf4 Bf2 g5 Rc6 Kg7 Qb2 Rd2 Qxf6+ Kg8 Qxh6 Rxf2 Bh3 Rh2#,-0.009111015
-0.041803222,0.012355062,correct_chess,d4 d5 Nc3 Nf6 h3 e6 Nf3 Bb4 Bd2 Ne4 a3 Bxc3 Bxc3 O-O Ne5 Nc6 f3 Nxc3 bxc3 Nxe5 dxe5 c5 f4 Qh4+ Kd2 Qxf4+ e3 Qxe5 Bd3 c4 Be2 Qg3 Bf3 b5 h4 a6 Qf1 a5 Rh3 Qd6 h5 e5 h6 Bxh3 gxh3 g6 Qg2 e4 Bh5 Qe5 Bxg6 fxg6 Rf1 Rxf1 Qxf1 Qh2+ Kc1 Qxh3 Qf6 Qxh6 Qe6+ Kh8 Qxd5 Rf8 Qxb5 Qxe3+ Kb2 Qf4 Qxc4 Rb8+ Ka2 Qf7 Qxf7,0.00035141964
-0.082499355,0.0295164,correct_chess,d4 c6 Nf3 Nf6 c4 d5 e3 dxc4 Nc3 Bf5 Bxc4 e6 Qb3 b6 O-O Bd6 Re1 Ne4 Nxe4 Bxe4 Nd2 Bg6 e4 Nd7 e5 Be7 Bd3 c5 Bxg6 hxg6 Nf3 O-O d5 exd5 Qxd5 Qc7 Bf4 Qc8 e6 Nf6 exf7+ Rxf7 Qg5 Qf5 Qxf5 gxf5 Ng5 Bf8 Nxf7 Kxf7 Be5 Re8 Bxf6 Rxe1+ Rxe1 Kxf6 h3 Bd6 Re8 Be5 b3 b5 Ra8 c4 Rxa7 c3 Ra8 b4 Rc8 f4 g3 fxg3 fxg3 Kf5 Rc5 Ke4 Kg2 Bd4 Rc4 Kd3 h4 c2 Rxc2 Kxc2 g4 Kb2 Kh3 Kxa2 h5 Kxb3 Kh4 Kc4 g5 b3 h6 gxh6 Kh5 b2 gxh6 b1=Q h7 Qxh7+ Kg5 Qg7+ Kf4 Kd5 Kf3 Qf6+ Ke2 Qf4 Kd3 Qe3+ Kc2 Kc4 Kb1 Qf2,0.005480227
-0.01898754,-0.003873194,correct_chess,e4 Nf6 Nc3 d5 e5 d4 Nb5 Ng4 Nf3 Nc6 Bc4 Ngxe5 Nxe5 Nxe5 d3 Nxc4 dxc4 e5 O-O a6 Na3 Bc5 Qh5 Qe7 Re1 Bd6 c5 Bxc5 Rxe5 Be6 Bg5 Qd6 Rae1 O-O Bh4 Bxa3 bxa3 Qxa3 h3 Qxa2 R1e4 Qxc2 Rf4 Qg6 Qf3 c6 Rg5 Qb1+ Kh2 h6 Rg3 d3 Bf6 g6 Qh5 d2 Qxh6 Qh1+ Kxh1 d1=Q+ Kh2,-0.004754918
-0.052751902,0.0072444724,correct_chess,e4 d5 exd5 Qxd5 Nc3 Qe5+ Be2 Be6 Nf3 Qd6 O-O Nd7 Ne4 Qc6 d3 O-O-O Nd4 Qa6 Nxe6 fxe6 d4 Qa5 Bd2 Qd5 Nc3 Qxd4 Be3 Qxd1 Raxd1 g6 Bg4 e5 Bxd7+ Rxd7 Rxd7 Kxd7 Nd5 Nf6 Nc3 e6 Rd1+ Bd6 Bxa7 Ra8 Be3 Ng4 Bd2 Rf8 f3 Nf6 a4 Nd5 Nxd5 exd5 b4 e4 fxe4 dxe4 b5 h5 a5 h4 a6 bxa6 bxa6 Ra8 Ra1 Bc5+ Kf1 e3 Bc1 Bd4 Ra4 Bc5 Ke2 Kd6 Bxe3 Bxe3 Kxe3 Re8+ Kd3 c5 Rxh4 Ra8 Rh6 Rxa6 Rxg6+ Kd5 Rxa6 c4+ Kc3,-0.03552699
-0.0060910718,-0.017746395,correct_chess,e4 d5 e5 d4 d3 c5 g3 h6 Bg2 Nc6 f4 e6 Bxc6+ bxc6 Qf3 Bb7 c3 c4 dxc4 Qe7 cxd4 c5 d5 exd5 cxd5 O-O-O Nc3 f6 e6 Qc7 Be3 Qa5 O-O-O Bd6 f5 Ne7 Nge2 Bb8 Kb1 c4 Nf4 g5 Ng6 Nxd5 Nxd5 Bxd5 Rxd5 Qxd5 Ne7+ Kb7 Nxd5 Rd6 e7 Re8 Nxf6+ Kc7 Nxe8+ Kd7,-0.010019981
0.020240102,-0.025389664,correct_chess,d4 c5 d5 e6 c4 exd5 cxd5 d6 Nc3 Nf6 Nf3 Be7 e4 O-O Nd2 Bg4 f3 Bh5 a4 Bg6 Nc4 Nbd7 Be2 h6 O-O Nh7 Bf4 a6 Nxd6 Bxd6 Bxd6 Ndf6 Bxf8 Qxf8 e5 Nh5 d6 Rd8 f4 Qe8 Bxh5 Bxh5 Qxh5 Qe6 Qf3 f5 Qxb7 Nf8 Qd5,-0.0016868357
0.01795549,-0.024334515,correct_chess,d4 d5 c4 dxc4 e4 e6 Bxc4 c6 Nf3 Nf6 Nc3 Bb4 Bd3 Nbd7 Bg5 h6 Bh4 g5 Bg3 Nh5 Qe2 Nxg3 hxg3 Bxc3+ bxc3 Nb6 a4 a5 Ne5 Nd7 Nc4 Qe7 f4 gxf4 gxf4 c5 f5 cxd4 fxe6 fxe6 Qh5+ Qf7 Nd6+ Ke7 Nxf7 Rh7 O-O Nc5 Qxc5+,0.0014264731
-0.037493777,-0.00088939193,correct_chess,e4 d5 Nc3 d4 Nce2 e5 Nf3 f6 c3 Nc6 cxd4 exd4 Qa4 Bd7 Nexd4 Nxd4 Qxd4 Ne7 Bc4 Nc6 Qd5 Qe7 O-O O-O-O Re1 f5 exf5 Qf6 Qb5 Bxf5 Qxf5+ Qxf5 Be6+ Qxe6 Rxe6 Bd6 d4 Rhe8 Rxe8 Rxe8 Be3 Ne7 Rc1 Nf5 Rc3 Bb4 Rd3 Bd6 g4 Nh6 h3 a6 Bxh6 gxh6 Re3 Rf8 Kg2 Rf6 Ne5 Bxe5 dxe5 Re6 f4 Kd7 f5 Re7 e6+ Kd6 Kg3 Kd5 Kf4 c6 Rd3+ Kc5 Rd7,-0.007562326
0.026016155,-0.02682412,correct_chess,d4 d5 Bf4 e6 e3 a6 Bd3 h6 Nf3 Nf6 h3 Be7 Nbd2 O-O g4 Nh7 h4 f5 gxf5 exf5 Ne5 Qe8 h5 Bf6 Ng6 Rf7 Qf3 c6 O-O-O Nd7 Bd6 Nb6 Bxf5 Bxf5 Qxf5 Bxd4 Qd3 Bf6 Rdg1 Rd8 Bf4 c5 Bxh6 c4 Qf5 Bxb2+,-0.0038649382
0.029716339,-0.017502507,correct_chess,d4 Nf6 c4 c5 Nc3 cxd4 Qxd4 Nc6 Qd1 d6 Nf3 g6 Bg5 Bg7 e3 O-O a3 Be6 Bd3 Rc8 Qc2 Na5 b3 a6 O-O b5 cxb5 axb5 Qd2 Nxb3 Qb2 Nxa1 Qxa1 Ng4 Rc1 h6 Bf4 g5 Bg3 Qa5 h3 Bxc3 Qa2 Nf6 e4 Bxa2,0.011972475
0.07609866,-0.004989814,correct_chess,Nf3 c5 d4 e6 dxc5 Bxc5 Nc3 Be7 Bf4 Nf6 g3 O-O Bg2 Nc6 O-O d5 Re1 Bd6 Bxd6 Qxd6 e4 d4 e5 Nxe5 Nxe5 Qxe5 Rxe5,0.012440164
-0.024827905,-0.016880646,correct_chess,d4 Nf6 c4 c5 Nc3 cxd4 Qxd4 Nc6 Qd1 d6 Nf3 g6 a3 Bg7 Qc2 O-O e3 Be6 Bd3 Rc8 O-O a6 Qd2 Ne5 Nxe5 dxe5 Ne2 e4 Bb1 Bxc4 Re1 Bd3 Nd4 Bxb1 Rxb1 e5 Nb3 Qxd2 Nxd2 Rfd8 Nb3 Nd5 Bd2 Nb6 Na5 Bf8 Nxb7 Rxd2 Rbc1 Rcc2 Rxc2 Rxc2 b4 Nc4 Nc5 Nxa3 Nxe4 f5 Nf6+ Kf7 Nd7 Bxb4 Rd1 e4 Ne5+ Kg7 Nd7 Rd2 Rc1 Rxd7 h3 Nb5,-0.02534846
-0.015797652,-0.008566522,correct_chess,e4 Nf6 e5 Nd5 Bc4 e6 Bxd5 exd5 d4 c5 Nf3 Nc6 Bg5 Be7 Bxe7 Qxe7 O-O O-O Nc3 cxd4 Nxd5 Qc5 Nf4 Nxe5 Qd2 Nxf3+ gxf3 d5 Rad1 Be6 Qxd4 Qxc2 Rd2 Qf5 Nxd5 Qxf3 Ne7+ Kh8 Rd3 Qg4+ Kh1 Qxd4 Rxd4 Bxa2 Rg1 g6 Rd7 b6 Ra1 Be6 Rdxa7 Rxa7 Rxa7 Re8 Kg2 b5 b4 h5 Rb7 Kg7 Nc6 Bd5+ Kg3 Bxc6,-0.0049811387
0.014550102,-0.016128527,correct_chess,e4 d5 exd5 c6 Nc3 cxd5 d4 e5 Nf3 exd4 Nxd4 Bg4 Qxg4 Qg5 Qxg5 f6 Qxd5 Nc6 Nxc6 bxc6 Qxc6+ Ke7 Qxa8 Nh6 Qxa7+ Ke6 Bxh6 Bb4 Qa6+ Ke7 Qb7+ Kd6 Qxb4+ Kc6 Bb5+ Kb6 Be3+ Kb7 Qe7+ Ka8 Bc6+ Kb8 Qb7#,0.027292484
-0.05030486,-0.002950973,correct_chess,d4 c5 d5 e6 c4 exd5 cxd5 d6 Nc3 Nf6 e4 Be7 Bf4 O-O Nf3 Bg4 Be2 Nbd7 O-O Bh5 Nd2 Bxe2 Qxe2 h6 Nc4 Nh7 Nxd6 Bxd6 Bxd6 Re8 f4 Ndf6 e5 Nd7 Nb5 f6 Nc7 fxe5 Nxe8 Qxe8 fxe5 Ng5 e6 Nf6 Bxc5 Rc8 Bd4 Nge4 Bxf6 Nxf6 Qd3 Qa4 Rac1 Rf8 e7 Re8 d6 Nd7 Rc7 a6 Qb3+ Qxb3 axb3 Ne5 Rxb7 g5 Re1 Nc6 d7 Rxe7 Rxe7 Nd8 Re8+ Kf7 Rxd8 Ke7 Re8+ Kd6 d8=Q+ Kc5 Qb6+ Kd5 Qe3 Kc6 Rbe7 Kb5 Qc3 Kb6 Rb8#,-0.03473302
0.009784625,-0.02397225,correct_chess,e4 e5 Nf3 Nc6 Bb5 d6 Bxc6+ bxc6 d4 exd4 Nxd4 Nf6 Nxc6 Qd7 Nd4 Ba6 b3 c5 Nf3 Be7 c4 Nxe4 O-O O-O Re1 Nf6 Nc3 Bb7 Nd5 Nxd5 cxd5 Bf6 Rb1 Bc3 Re2 Ba6 Re4 Rfe8 Qc2 Rxe4 Qxe4 Re8 Qc2 Bb4 Bd2 Bxd2 Qxd2 Bb7 Rd1 h6 h3 a6 Qf4 Qb5 Qxd6,-0.005978448
-0.028684048,-0.0072797206,correct_chess,d4 Nf6 c4 c5 Nc3 cxd4 Qxd4 Nc6 Qd1 g6 Bg5 Bg7 e3 O-O Bxf6 Bxf6 Rc1 d6 Be2 Be6 Nf3 Rc8 O-O Qa5 Ne4 Bg7 b3 Rfd8 Nfg5 d5 Nxe6 fxe6 Ng5 dxc4 Bxc4 Rxd1 Rcxd1 Qxg5 Bxe6+ Kf8 Bxc8 Qe5 Rfe1 Kf7 f4 Qc5 Bxb7 Nb4 a3 Nc2 Re2 Nxe3 Rb1 Ng4+ Kf1 Nxh2+ Ke1 Qg1+ Kd2 Qxb1 Bd5+ e6 Bxe6+ Kf8 Bc4 Qb2+,-0.0075403824
-0.032031424,-0.0058157053,correct_chess,f4 d5 e3 c6 d4 e6 Nf3 h6 Nbd2 a6 Bd3 Nd7 O-O Ngf6 c3 b5 Ne5 Nxe5 fxe5 Nd7 e4 Nb6 Qf3 Qe7 b3 Ra7 Qg4 Bd7 Nf3 Kd8 Bd2 g6 Nh4 g5 Nf3 Be8 Kh1 Bg7 Ng1 Kc8 Be3 Nd7 Rf2 f6 exf6 Nxf6 Qf3 g4 Qf4 Rf8 e5 Nh5 Qxg4 Rxf2 Bxf2 Qf7 Nh3 Qg8 Rf1 Bf7 Bh4 Rd7 Bg6 Bxg6 Qxg6 Nf4 Rxf4 Qh8 Rf7 Rxf7 Qxf7 Bxe5 dxe5 Qxe5 Bg3 Qxg3 hxg3 e5 Nf2 e4 Ng4,-0.016163442
-0.05871705,0.005972484,correct_chess,e4 e6 f4 d5 e5 c5 Nf3 Ne7 d4 Nbc6 Bb5 Bd7 O-O Nf5 c3 cxd4 Bxc6 Bxc6 cxd4 Be7 Nc3 O-O Kh1 h6 Ne2 Rc8 a4 a5 b3 Bb4 Bb2 b5 Bc3 Ne3 Qd3 Nxf1 Bxb4 axb4 axb5 Nxh2 bxc6 Ng4 Rc1 Rc7 Kg1 Qa8 Qd2 Rb8 Ne1 Rxc6 Nd3 Rxc1+ Nexc1 Qa1 Qe2 Qxd4+ Kh1 h5 f5 Rc8 fxe6 Qf4 exf7+ Kxf7 Qf3 Qxf3 gxf3 Nh6 Kg2 Nf5 f4 Rc3 Kf3 Nd4+ Kf2 Nxb3 Nxb3 Rxb3 Nc5 Rb2+ Ke3 Rb1 f5 h4 Kf4 h3 Kg3 b3 Kxh3 b2 e6+ Ke7,-0.020992383
-0.02034985,-0.010562541,correct_chess,e4 Nf6 Nc3 Nc6 d3 e5 Be3 Bb4 Qd2 Ng4 a3 Ba5 b4 Bb6 Bxb6 cxb6 b5 Nd4 O-O-O d5 f3 Nf6 Qg5 Qc7 Qxg7 Rf8 Qxf6 Qxc3 Qxe5+ Be6 Rd2 Qxa3+ Kd1 Qc3 exd5 O-O-O dxe6 fxe6 Ne2 Rf5 Qxd4 Rxd4 Nxc3 Rb4 Re2 a5 Rxe6 a4 g4 Rc5 Kd2 a3 Bh3 Rb2 g5 a2 Re8+ Kc7 Ra1 Rxg5 Nxa2 Rgxb5 Nc3 Rb1 Rxb1,-0.024733972
-0.0029065686,-0.01883027,correct_chess,d4 Nf6 c4 e6 Nc3 c5 Nf3 cxd4 Nxd4 Bc5 Nf3 a5 Bg5 Ra6 e3 Rd6 Qc2 Nc6 Ne4 Nxe4 Bxd8 f5 Bc7 Nb4 Qb3 Rc6 Bf4 Be7 Bd3 Nc5 Qd1 Ncxd3+ Ke2 Rxc4 a3 Rc2+ Kf1 Rxf2+ Kg1 Nxb2 Qe1 N4d3 Qxa5 Rc2 h3 O-O Ne5 Bc5 Nxd3 Nxd3 Qb5 Nxf4 Kh2 Rxg2#,-0.0043965783
-0.026099047,-0.006214701,correct_chess,Nf3 e5 Nxe5 Nf6 e4 Nxe4 Qe2 d5 d3 Nd6 Ng6+ Be7 Nxh8 Be6 Nc3 Nc6 Bf4 Nd4 Qd1 Qd7 Ne2 N4f5 g4 Nh4 Ng3 O-O-O b4 Bxg4 Qd2 Nf3+ Kd1 Nxd2+ Kxd2 Rxh8 Re1 g5 Bxd6 Bxd6 Bg2 Bxb4+ c3 Qa4 Bxd5 Bxc3+ Kxc3 Qa3+ Kd4 Qb2+ Kc4 b5+ Kc5 Qc3+ Bc4 bxc4 Ne4 Qa3+ Kxc4 Be6+ Kd4 Rd8+ Ke5 Qb2+ d4 Qxd4#,0.006540923
0.026854975,-0.02491449,correct_chess,e4 b6 Nf3 Bb7 Nc3 e6 d3 Bb4 Bd2 Bxc3 Bxc3 Ne7 Be2 f6 e5 Ng6 exf6 gxf6 Qd2 Bxf3 Bxf3 c6 O-O-O Qe7 Rhe1 e5 Bd4 c5 Bc3 Nc6 Bxc6 dxc6 Qh6 Rg8 g3 Qg7 Qh3 Ke7 d4 Rad8 dxe5 Rxd1+ Rxd1 fxe5 Rd7+,-0.006853836
